asset,query,published_at_utc,title,summary,url,source
Solana,SOL-USD,2025-12-05T21:21:32Z,Solana Price Forecast - SOL-USD Rebounds to $138 — SOL-USD Price Target Eyes $200 - TradingNEWS,,https://news.google.com/rss/articles/CBMipwFBVV95cUxQS3ViVUlWdkRmWXY0NEw5TjhHa3R3dFY2d0JzODNyQVltTmRqaURsMHNhOF9GWXJRVWdWV00yM194ajNLb3RTQmt6dXFObHczQ2VIckNOQ0xhY25yMGpaUmhTT1FnTUk0TmpIc1NZd0VoYUdkcUtPYmhBdVFwcDljTmFpX0hjRkNFYVZad2syb0ZiRzMzREt4NVl3R3ZLQWMySGlRcUEzOA?oc=5,gnews
Unilever,UL,2025-12-05T21:05:30Z,UL Solutions (NYSE: ULS) selling stockholder completes 12.5M-share sale at $78 - Stock Titan,,https://news.google.com/rss/articles/CBMipwFBVV95cUxNbnR5TkdmVUdJcUZkNG5INFRtWm93bFQ3XzlvY1hzZHo2YTlhb3BlaVpqaW01WmtDOWxnVlNwc2UyM05OZFY4U0ZRa3lydHNTNExPNXRLOGlKN2ptUlFOZ3AwLXRmTGd0NlBCU196UHdMYkx3T1lrOFhRN0dkUVJudHhJME9sVFB1LUVPaWJaUzRPR2pjTkF6VXR0ZW82c1FiNkRSY21iYw?oc=5,gnews
Novo Nordisk,Novo Nordisk,2025-12-05T21:05:14Z,Court Ruling Sways Novo Nordisk And Dr. Reddy’s Shares - Finimize,,https://news.google.com/rss/articles/CBMiiAFBVV95cUxPalVOQUJvZ0FjUllkeXYwc0hQdUJBMDV0Wm9XNXNKZlVick1TZ184SEtBS0Fob0hSUU5iakt6Nnl3Q0J6Yk0xRzV1U2tlSjBSY3BhVXZFQWxBMGxHcDR0UGV0ZzdfY1F5MWQ2ZGN6OHM0SEJBaGJDLV9TTnNRWnc1YjNqaTBqX25i?oc=5,gnews
XRP,XRP,2025-12-05T21:00:34Z,XRP Price Today: Can XRP Hold Its Rebound From $2.02 as Ripple Integrates the Token Into $12.5T Enterprise Systems? - Brave New Coin,,https://news.google.com/rss/articles/CBMi3gFBVV95cUxPN2I4V2FxOHctZU0yWnlJbFBBSWJzb0k3LUk0dFd0dnlyUFhCdXowVnh6VkJGcEFSbHdnOEhjbWZtLWM2Unl6d0xmZExRd0Jld0xZZDRXNGgzZnpjTEdHQWJHc2VMV3lPM3dRODBrZUhGU0lpMnhCb2VqbFAycGdjVElVY2FIS3hEczdVNmcyQy1vcWJ1MTQ3akdVLUdQTEJVbTVQRTlEZVV6S1Z3d05mQkUwempDajZGa2J3Y3kzWDViQTNMSHU3R3gzeGQ5YWxUWGlYV1NrM18xV2tGWEE?oc=5,gnews
CrowdStrike,CRWD,2025-12-05T20:56:57Z,CrowdStrike's AI Reality Check (NASDAQ:CRWD) - Seeking Alpha,,https://news.google.com/rss/articles/CBMieEFVX3lxTE91WXZTTWttTUpUR1FjUlZ6cldFWkNuSlRCNDFfNUVncjdwclZjTllxb3pKU2NSVnE1NXR6QkJVLWs5eHJEbkp2Ums0YVY2SkdGalB6dko2WWlNQXl2aFZBRmlsb2ZTcUlNdHZxLWNzOHhfM1duek1jVQ?oc=5,gnews
Siemens,GlobalFeed,2025-12-05T20:44:17Z,Automobilindustrie: Sechs EU-Länder fordern Aufweichung des Verbots von Verbrennungsmotoren,"Sechs EU-Staaten stellen das geplante Verbrenner-Aus infrage: Sie drängen die EU-Kommission, Hybrid- und andere Technologien auch nach 2035 zuzulassen – und warnen vor Wettbewerbsnachteilen.",https://www.handelsblatt.com/politik/international/automobilindustrie-sechs-eu-laender-fordern-aufweichung-des-verbots-von-verbrennungsmotoren/100181480.html,rss:handelsblatt.com
