asset,query,published_at_utc,title,summary,url,source
Robinhood,Robinhood Markets,2025-12-28T15:23:46Z,Robinhood Faces Market Volatility Amid Customer Decline - StocksToTrade,,https://news.google.com/rss/articles/CBMifEFVX3lxTE5RblNhN08zVDBSSm90Q3ZYSkRJcGZVNVBlY2luSHdHY2VWN2tSUEt0b0prT3pScHYweWdUdlhTMURJWUZXRWRON0ROalpnSzBJODFZaWYxNjluVDhaTjN4bml5LW1ZaFlqWWp6SnlDSTh1VnhCRFd2amFIRTM?oc=5,gnews
JD.com,GlobalFeed,2025-12-28T15:16:08Z,"Handel: Großaktionäre, Saturn-Zukunft, Strategie: Die Europa-Pläne von JD.com stoßen auf überraschende Hürden",JD.com übernimmt die Kontrolle über Media Markt und Saturn. Der chinesische Konzern will einen europäischen Champion aufbauen. Doch gleich mehrere Probleme werfen Fragen auf.,https://www.handelsblatt.com/unternehmen/handel-konsumgueter/handel-europa-plaene-von-jdcom-stossen-auf-ueberraschende-huerden/100179772.html,rss:handelsblatt.com
Robinhood,HOOD,2025-12-28T15:11:18Z,Morgan Stanley Raises Robinhood (HOOD) Q4 EPS Estimates on Surging Year-End Transaction Volumes - Finviz,,https://news.google.com/rss/articles/CBMiwgFBVV95cUxNWENyT0U5a1J0V015WDJxRy1BX0RnUjVJSUJrODBTMm5jLXhrT0o1VFpLMHJYQ3JNejJKOWVUYkFxa0c0cXFzZ3kwdUFqNnRXNktVR2dFTzE5UHp5LTVDb0ZpWGtUemRWU01HUDNCaWdCNUg2Sl8zaGRRU3JBRVh0UFlXMV8zdmZiRTZXOFFRcGgyQUhVcHdzdUVBSnBUZ0FhZ1NNN01PTEx3bTRKZWxJZEQ5TTRBdGI5d0o5SmswOWZ0QQ?oc=5,gnews
Novo Nordisk,NVO,2025-12-28T15:00:00Z,Novo Nordisk: Oral Weight-Loss To The Rescue (NYSE:NVO) - Seeking Alpha,,https://news.google.com/rss/articles/CBMijAFBVV95cUxOYUU5Z0NqMDRGTW50WUlUWnlhd0tSZ0YzV2FadEpoTnFmVk9VQXl5UnZjMHJoaXgzTm5kQkF2N3poS0ZXeWE5XzcydEU2MlFlbVpFTk4wM2lLTDh4ZU52OEc5anlzODJWT0xuVjVsWFVmcU93SE1yYkFDLUY2WFdIVTVwUDdNX3d1c0RaLQ?oc=5,gnews
XRP,XRP,2025-12-28T14:53:07Z,"5 XRP Catalysts Coming in Q1 2026: RLUSD Japan Launch, BlackRock ETF, and More - 24/7 Wall St.",,https://news.google.com/rss/articles/CBMiuwFBVV95cUxNTUpyVGgxWmplMjZQNnBPb2lwdnNOZXlHZzZKckszWFBSUUV5QVZaUk9SLWlwaXN0bm9PdHJqMGtqUmFVaGVuU1VEWktWb2pSRlc1RmU1TjJrZVN4endPZWstNlZMTTczZGVsVkY1NlZpVlo3Q2U1NU1YeEtUcXpocFZ6ZE1DWDdvaE9UaTJJZl9ybDJnUnF5cFpUTmp1TnA4WGh0NW5yZ3RZbHpPVnlFWUw3RTdrWVJabzlN?oc=5,gnews
XRP,XRP,2025-12-28T14:50:22Z,"XRP News 2026: Ethereum Network Activity Pumps to New Peak, DeepSnitch AI Closes in on $1M as Presale Demand Skyrockets Ahead of Rumoured 100X Launch - CoinCentral",,https://news.google.com/rss/articles/CBMigAJBVV95cUxPVFRMZnNHdEpZckVWUjVMUDJfVE5pbkNBM3JWeDVmeHZ1TjN1cHdxWUpKNU9VNGRwWkVkRmhxbjcydHptVk9NaHI4Z0hvLXZjN244MVp4MlZQXzNlUGRhcmh0ZVhMTXd4QU94QkpWMmY3dld0MmpQNVdDaHR3M09MWlVqMV9NZ1h0UFFpb195SVMtVlhpNXM0RVdvVzdienR5SVIwRm1NeVJBSkdEWTFnZDZqcXhkQmlDczZ1U3c0N2p0WFFpS2xmTzMxMDh2R2M1ZTBLSnBvMWJaTlUwYVNGRUlDOXhiV0NDeFp4eWlHX25EOXgwN0RZczY4NmNRQlEy?oc=5,gnews
NVIDIA,NVDA,2025-12-28T14:49:46Z,"Nvidia Stock (NVDA) News Today: Groq AI Inference Deal, Wall Street Targets Up to $352, and What to Watch Before Monday’s Open - ts2.tech",,https://news.google.com/rss/articles/CBMi1wFBVV95cUxNWVZDZnpuU2ZERWZVQ3NPOEJ4ZzNtY3ZEZUE4R0hSTmlZX3ZMOVoxVm9wVHlnNE1rODVYQWlnWnRuRmduODJ3eHFxNUNDUkJGdXFJZmlRY1J1dmhZWUUyeEFJYTBjSjZUVDI0YUNpamNfdDQydy1BMEVkS3RiYXduWm4zT0I2emlnSHBxNjZZYlo3QkNVU2F4R0RMeks1Mjc1b2FOczJfQVgtTTRVUWZBZE5ZNHY3WUFKQnpNN3FUWDdlNTJGWEZlSUx6R0tKQXYzYWQ4eXFaQQ?oc=5,gnews
Solana,Solana,2025-12-28T14:45:46Z,Solana Co-Founder Predicts $1T Stablecoin Supply by 2026 - Live Bitcoin News,,https://news.google.com/rss/articles/CBMikgFBVV95cUxPR0RSUkI4Wko4WVFDS0xJWExiRHJndndNMDNVZ2x4cFlNYkJlc1VZNTk4Mm5lRXk2Nk9ycVptcDhNYlN0Z0dobkI4ejQwZmdrdVZLMF81U2pkNzJWMndvMHotVEpMbEtRX1RBLU9GYklReV9pSEctVlU1dGh6TWE2MVJyVElDSVpFM0E4dTZHWURTdw?oc=5,gnews
Ethereum,ETH Ethereum,2025-12-28T14:40:00Z,Ethereum’s two markets: whales accumulate $350M as retail confidence crumbles - Cryptopolitan,,https://news.google.com/rss/articles/CBMiggFBVV95cUxOZExsOEtRMVlxMFV4ZW5zbWcySlRpVDNuR01TOTE1eGc0RElnSW9BVEcwMkJIQ2c2Z2dHaUM3WUh1UWFZeWtGT3pIeDlON1VvNkNCVWg4U2FEeUJhbXdYX3dEWGNXc3ZPUmgxbU5FVTZwVkluX09ZRmZCMFZmQ2g4R29R?oc=5,gnews
NVIDIA,NVIDIA,2025-12-28T14:30:02Z,Nvidia Stock Had a Volatile 2025: What’s the 2026 Forecast? - Barchart.com,,https://news.google.com/rss/articles/CBMiowFBVV95cUxOM09CR0JLM3loaUV0cFVlTkZBcDlMXzhBWkJJRzNKSGNFX1l6dE5zTzZYbDg1TmRPa2UzTHBxaTdYcnhpZFVVcm1vZkI1YzJpZWI1a0Z1TDJYc2hFWDF5ZktqMm1DSmFBWWduRDU4aFFQeGllYnktWDNQNG9lcFY2bGhwYS1tT2cwWmFJMHo2OGFCN1ZqYlZhQldjTjFQWXo2bDdV?oc=5,gnews
