asset,query,published_at_utc,title,summary,url,source
XRP,XRP,2025-11-12T19:18:30Z,XRP Price Prediction: Ripple Bets $4B on Financial Network Expansion – Will XRP Finally Moon to $5? - Cryptonews,,https://news.google.com/rss/articles/CBMivwFBVV95cUxQbEF5Zjc5Z01ra19NRXh5U0gzOU1kV3RLaVRXMV9GVHZGU25aX2pPM241bVdCQW5iTzZDYUxmMUVCZW9va0tiYURVN21PYV9uenFrTW1YemwwOUZrMVdLbHI4NGhVWDI5UWV1eW1McEFsdmVqY1dNT0RIYW12N24taG1Sb0Y3U0UwTFAtelBkYXBoajlQX1VtcC1EdnIzMVpqYmlDamhMTjVPaWNGU1oxcUdVVmlybWtnQXNxYUJqYw?oc=5,gnews
Alphabet,Google,2025-11-12T19:18:03Z,AI data center tops Google $6.4B investment in Germany - AI Business,,https://news.google.com/rss/articles/CBMinAFBVV95cUxNX1VvcGswMmxrTXF5UzZUbER4T2FqYmktX2hmMkFPYUZGaS11V3A4cnJscG1xd0ZRblF2Z2lGdlZiS0haZUtlUTV2OUlxR3lQbkY1dHhMTEpiVW9zUnlPTzE0a1dMejczRThkWUdFaWxWQ2hLeXhXQjlXcUkyMGQwU2xnV2RMcmRxcHdNQ2JvQWZtN1I1N3dQcDRpbzM?oc=5,gnews
BP,BP,2025-11-12T19:17:38Z,BP in active talks with Stonepeak over Castrol sale - Reuters (BP:NYSE) - Seeking Alpha,,https://news.google.com/rss/articles/CBMingFBVV95cUxQdGNYT09kLVI5QXJmQnJtbGs1a3lyUlZaSU5BeWsxRkNWYUxtZXNsZllET0s0cHJTTWl0MTl0YlhpWFRrc2x5YVBrelROaWFNYVo1cmdoY01wX2loU0MxZ0p4ak12SzNXQnptdGdsY1FKcXJTVUVENGVNNUFFNTZFejE0LTV6M3d5T2JDZWEwRFZGRjV5STZocmhVU296UQ?oc=5,gnews
Coinbase,COIN,2025-11-12T19:15:44Z,BlackRock CEO Larry Fink Says Bitcoin and Crypto Growing Rapidly - CoinCentral,,https://news.google.com/rss/articles/CBMikwFBVV95cUxPM3lQMVIzT04tZkNSbXNCdVpzVV9NQWNXU1dmbGs5SlhtSTM5WHFIbjNVWGo2VTdoVzg4Z2hTWWlaX1RieGJYcXpxTmVIRHViTEwyTW8zb3ZBVWhpN1FXZ0NyajBTQWlXV1I2eE9PWEhtNWFzbkRPZFlUcjFSSl9vaXhaelVUdW5NMG9kQ1pNMVo1Zzg?oc=5,gnews
Coinbase,COIN,2025-11-12T19:12:31Z,"Coinbase Global, Inc. (COIN) Stock: Reincorporates in Texas Amid Shift from Delaware’s Legal Framework - CoinCentral",,https://news.google.com/rss/articles/CBMivgFBVV95cUxOUWE3blZCRGxNVDRzUm9kTFJIcWt4R0Fnbkp1QlBzVU5HUTVBOVd2dVdQZFZDaVc5OEQ5VmV2RVc5ajNhWGJ6Uk11WWwtVUo4eWgwYzJab0UzTW92OUNRYWhSMGlPRHcyODFKVnUtamUyNzBvUTNMaWs3aFVxU1pLNnBUQzZDMWxTTzhoVVQteTRsOEp0MEluUHFYS0h1T0lIR29HWlZFbTFFZnY3Z1pwdDdBeWlKaTV5SWpicTBR?oc=5,gnews
BYD,BYD,2025-11-12T19:12:10Z,Learn to Evaluate (BYD) using the Charts (BYD:CA) - news.stocktradersdaily.com,,https://news.google.com/rss/articles/CBMinAFBVV95cUxOT2Izc3FQVU5oMXVHX0lfblhsRExkYXhFLVViZHpQQTBlZ3Rma2ZKSGNIWFZjLV9Xbk9XTnVwY2h4d29va2pFdFZ6YzZ5VTZXUnVjMjN1MG9HRW9PRHBLOU9uYWZLUE91cTRwSEUtZ2psVlhQQzBlVVIyZnNHRWNtNGVSLV8wUGNFTFRDSzRKWXVzejNiVS1hbEhTZUQ?oc=5,gnews
D-Wave Quantum,D-Wave Quantum,2025-11-12T19:01:43Z,D-Wave Quantum Options Trading: A Deep Dive into Market Sentiment - Benzinga,,https://news.google.com/rss/articles/CBMivgFBVV95cUxOVzlrd1FkMEFuWHdncVEwNFNZVmZrWFN4cDllTUx5SnlmYjJiQ1JQaVpSS3ZFczZaODUyZmRBdHNubTN1STZtRFlQSm9LeGpSU0MwR0Vva0NoNGJRUEtVWDFZQVVTMTl6OHJzcHBEQVFxbll4OUs0cDYxYzc5Q3hlbTVGSmJYdURyUThmNWpJdFZyaUw2Sl9oWkM1bUVhRUhHbnFoMGktSGUwZ1ZGcHpibUJlNWlkdXNLaW9PbFJR?oc=5,gnews
Rocket Lab,Rocket Lab,2025-11-12T19:00:44Z,How Is The Market Feeling About Rocket Lab Corp? - Benzinga,,https://news.google.com/rss/articles/CBMirwFBVV95cUxNc0NnNWRpWktoa2hMOHZibHlFUjMxanpvd1ZjMzBKOFY4UjlOT0hiYnNjTXNFYmxWd3hmc0J3ZVNOaTRaTnFQMW4yYjNGOVh0Y0NGQmVYbjBZQVpJZTVwOFoyQmVyZTFDRktLbzhuWldRLUM4SEdVcGxjQmUtcWM4T1pJYWhtd25qcFpsLXhFNGEyMzVMZUtBUTQ0a1RFN0k4WWJQODBBWjF3MUQ2UE04?oc=5,gnews
NVIDIA,NVIDIA,2025-11-12T19:00:06Z,The Nasdaq Whale’s Nvidia Sale Smells Desperate - Bloomberg.com,,https://news.google.com/rss/articles/CBMiowFBVV95cUxNRFhnblBrN1MtMkZKUXZYX0xOcjBIeUNKTHdvRWp0TDVBN1dtQWFiMHNLcHJ3TXFxZ3hVa0l6XzhIdHZtOW1BZ19HLXNUS0U1ZXJyMGZ5bHYzc1JyY0wzSHo4dEJXRXRHS01ZdXVSTHliREFvT0lRa2dSQjVQNDk3Y0czczZONHpGcEVNMkloUzNpVkx0MDEtU01wbzItREF2dTBZ?oc=5,gnews
Bitcoin,BTC Bitcoin,2025-11-12T18:59:32Z,MSTR Slips 3% Even As Michael Saylor Lauds Bitcoin's Role As 'Digital Capital' - Benzinga,,https://news.google.com/rss/articles/CBMi0gFBVV95cUxQNVpkSVZMSmg5WUVVWVpqZnNyaHVMTVAwY2lKMGpxbDF4WTlyMHdYTFBtanR3QUlqMFlKNWJGNlZxMWJkZXNxc2R2cjBybWxreEF5T0dqNFRURk5VUGQtb0ZJV0dhcE1BQjRTWlJybE85NlBwa0ptXzdaYm8zeGh3dXBQc191am1KZXp2N3drWHFUUVFMVTBCMjMzTUs5R1pXd04yWUFxa0ZpaS15SV9udHp3LWdrdnczUHZrUUM3ei1oNDViX05CclFCcmZibklUN1E?oc=5,gnews
Siemens,GlobalFeed,2025-11-12T18:59:21Z,Industriekonzern: Seit 1993 im Unternehmen: Veronika Bienert wird neue Finanzvorständin von Siemens,Die Managerin soll im nächsten Jahr die Nachfolge von Ralf Thomas als Finanzvorständin antreten. Der Vertrag mit einem Kandidaten für die Nachfolge von Siemens-CEO Roland Busch wurde auch verlängert.,https://www.handelsblatt.com/unternehmen/industrie/industriekonzern-veronika-bienert-wird-neue-finanzvorstaendin-von-siemens/100172346.html,rss:handelsblatt.com
Siemens,GlobalFeed,2025-11-12T18:59:21Z,Industriekonzern: Seit 1993 im Konzern: Veronika Bienert wird neue Finanzvorständin von Siemens,Die Managerin soll im nächsten Jahr die Nachfolge von Ralf Thomas als Finanzvorständin antreten. Der Vertrag mit einem Kandidaten für die Nachfolge von Siemens-CEO Roland Busch wurde auch verlängert.,https://www.handelsblatt.com/unternehmen/industrie/industriekonzern-veronika-bienert-wird-neue-finanzvorstaendin-von-siemens/100172346.html,rss:handelsblatt.com
XRP,XRP,2025-11-12T18:58:00Z,Could the United States' First-Ever Spot XRP ETF Launch This Week? - The Motley Fool,,https://news.google.com/rss/articles/CBMimAFBVV95cUxPQ1BTUjhvaXhmSk5FTlp5N3FiZXR2a3BOSVAwem84SV9HVTFUQldWajRGSld2TkQxTkUxbDdYQlgxUkU5aUpDTXU0UG1VV0xnRUpITlRaMFhRWnVMZ0VDRENYaDJJRF8wN01fc0w2QUVpN1JOMGZ3eGk0eDRELXMzRjg5TlZmb0l6U1o4eEhvNUxWYXdwV05RVw?oc=5,gnews
XRP,XRP,2025-11-12T18:52:05Z,"Missing October data to be ‘never released’ sends Bitcoin, XRP reeling hard - TheStreet",,https://news.google.com/rss/articles/CBMiigFBVV95cUxOWDVmOVltMlp2M1N6QmtMWFRaSjRxUTdfN2JRZUpJLW40WFd1cWdMNXM0OVF6aHFXR09zYm1fZllscEYtSE5CUzdpeWVDbDBJekFTTWdYTkE1Sm5sUGxQaWxKdFllT3hBZnNQcXAyN0JHdXlmUDN4OHFDeU9IX3FBLVVBOXlaWGtFZVE?oc=5,gnews
Siemens,GlobalFeed,2025-11-12T18:51:58Z,Entkonsolidierung: Siemens spaltet Healthineers ab,Die Aktionäre erhalten 30 Prozent der Anteile an der Medizintechnikeinheit. Veronika Bienert wird Nachfolgerin von Finanzvorstand Ralf Thomas.,https://www.faz.net/aktuell/wirtschaft/unternehmen/siemens-spaltet-healthineers-ab-110777973.html,rss:faz.net
XRP,XRP,2025-11-12T18:50:23Z,Time To Sell XRP? These 3 Indicators Scream 'Take Profits' - Benzinga,,https://news.google.com/rss/articles/CBMiuAFBVV95cUxOUmhjenphYmg1b2R6ZkRfa1Q2TEk1dmlTRW9MVVJ2STJrUmVTMmhaSEwxSDE5ZC1sUllTRFhPTzNNdEVrS3VkejZPOS1VbWt6ZUd0UklfUFhNWEVjRTIyMll4TDQwQlduVGE1QVdINVlUZU5xZUF0WWhCaUMxZEJZYUpfT1B1dGdCTm1tWDNiQTBnQWZzSVM4NzdjcEpjYTVfZFhJdHdNa2t6SGJQZFpGTFMtQlc0b3cy?oc=5,gnews
Novo Nordisk,NVO,2025-11-12T18:49:47Z,Novo Nordisk (NVO) Is Preparing to Launch Its New Weight Loss Pill – Here’s the Data - TipRanks,,https://news.google.com/rss/articles/CBMirgFBVV95cUxNWnhyWGExNjk1Q2UwOVJsNUc1QWFlWkNoOENXUnBiV1NOX2N0WVUtRmZZSURDTlI5RnNaQ3l4YWRia1pIbWJiN25JbVFuWUNKQ0lmQ0FFZGdlUHlQanJXVktITGk4ZG9iRXJYVHZ0MTNYdHU4dTk3YVpNSU1YamVsWFlmZDhYVUVXWlZHc1FqeFlPYUZFRzNIc2REMkZNUnp1ejF3S3FsektCV2NOTWc?oc=5,gnews
Alphabet,Google,2025-11-12T18:49:46Z,Google Adds AI-Powered Guidance for Ads and Analytics - Social Media Today,,https://news.google.com/rss/articles/CBMinAFBVV95cUxNc1IwXzBJRVQ2clZnQ2xEODR2V09BQWxFTElSbVRuSF8zby16VHN5SF9JbFVTeENpZER4U1duV0ZSWUhhWGtycnlRcG91NEh1ODd4YmwzQkpLc0pfV1lwUTRlVUFvTlFDSXBxdzB5RUNNOVYxaExUaTRQRkJaSUxLOWljTmdZZUN4MG02dnZjOVZSZnZVNXI5aDVNVnc?oc=5,gnews
XRP,XRP,2025-11-12T18:47:47Z,"Google’s AI Gemini Predicts Price of Ethereum, XRP, Cardano by End of 2025 - CryptoDnes.bg",,https://news.google.com/rss/articles/CBMingFBVV95cUxOdF9URnRMbVNMTDA4TlhTY0pQVGxJWXZ0LXlSTFAzaHMxT2YxQ0l2Rldod3M5ZVY3U2JWbXE2TU8zTWVfQ05uRk9sekg3c0pOaVMzRGZhYThQSVhIWkZjS2txZkRJNWNYUFVkYUNuQVRadGNVdXZCQnljR2JVWGRCbl9MRHpQbHNhTGtNMFZldmdsSTRrQUZSZm9GeDhMZw?oc=5,gnews
NVIDIA,NVIDIA,2025-11-12T18:42:35Z,Nvidia denies $1 billion investment in northern Mexico - Reuters,,https://news.google.com/rss/articles/CBMiwwFBVV95cUxNVGdVQ2NiMmZSMFhjbWh2Z0Z1LTZkSnNOajdqd005UEI1TlJrUjVLVm03amR1MUJUQzF6bjgzaHR1VjZpS3BudDVhbUZtRVE0Q1o4dGhkZjdMWWQzZ3BzOUpaSnBXTXZVSUVMY1I3X0VoY01kVXV4ZWNQcW81MGxDWU5rTzJlVW1QdF8tbVg4X29uRXZZQ2R4d21MaGZUOFpQN2ZXemhsRXNUaXl3aVdncExKbkVTRjYtaEdRU1I2b1JqUm8?oc=5,gnews
