asset,query,published_at_utc,title,summary,url,source
Siemens,GlobalFeed,2025-12-11T14:19:42Z,Verteidigung: Nato-Generalsekretär: „Wir sind Russlands nächstes Ziel“,"Der Kanzler und der Nato-Generalsekretär stimmen die Deutschen auf schwerere Zeiten ein. Sie beschwören die Einigkeit der Nato, aber für Verteidigung müsse mehr getan werden.",https://www.handelsblatt.com/politik/deutschland/verteidigung-nato-generalsekretaer-wir-sind-russlands-naechstes-ziel/100183058.html,rss:handelsblatt.com
XRP,XRP,2025-12-11T14:15:00Z,"Crypto News Today: Belarus Blocks Major Exchanges, New XRP ETF Gets Approval, Dogecoin Volume Surges, Bitcoin ETFs See Inflows - Analytics Insight",,https://news.google.com/rss/articles/CBMilwJBVV95cUxOcndqSHI2NWV1ZTF4VUQ0VnNSM0JiLVZMWlpuZkJKRmxVaElzM3JHU1FfQkVPWjFjam9LaDI5em5fQldNWEVpbTZEeEt3NzNLb2JSRmpfbDgwVGF1VFA5cU9wRGt3NDlmNWttTlZ3YlE2Y3dqa3JvT0dnZTZCbUdHMTlXaDFMOFgtNFNQdXJIMjVpSnpDbmo3bm5VN25JZ05tNVNjZmhmcXhMWjItZlFrYzNXZTZWUXRhRlg1ZEhZOUtDb2hMZ0x0c1FnYWozWkxFd2NWZnpxWXJfeFVUd1JqNEM0YkJQSk45cV9nbDQ0d01YdEJlWE1icmVSUXAtVVJaT01qc2d5YTJHYlRGZW1xNERKbVBPWnPSAaQCQVVfeXFMT1VodmV4UDMtc2V6U0VCVzF1am5LdUlqR1JvTmxZVWtZRzhySzVjV0VaQm9uRU51eTh0bWI3bElOT0l0YnVQM3BWT3ByRGRtSGhKRnFpbUZydHFOWHNocGE0RXA0c1U2MC1MOXRUSkpVQzlyd3VnSWpyVGwyMmZTX1FDR2ZPOXBpLXhZRHhxMG1YSUNLV3R3SUJmTU9KaHN1NmFqZVotUHAzSTdaTkpESW9Oa29WbllNeEoyeFoxQzY2OTkxWXdsQTVkZGszcW84cVpMUlZrRzBldXg5ZXZLNVBmMEhNTDJtbTZtTEVucmc4bURuRXlOa29XOEl2ZGZ0QkRmaFU2cVNrZk1laU43aFdtUGN0cklyM1BoS2pWNWd1X0xrTA?oc=5,gnews
Coinbase,Coinbase,2025-12-11T14:14:58Z,Solana Tokens Go Live on Coinbase Through Built-In DEX Integration - Coinpaper,,https://news.google.com/rss/articles/CBMimgFBVV95cUxOSmpjMHBqVU83dE40OU5tMVZ4Z2ZYaTYybDBJNVM2TnhWT0R5YlN1S3lMNWZRZmtwd0dmeTJuMVJpN1BmdU5aNDMzZHZ2ekN1ZlVIM1BZOVNCVnNHLW1yWjJfUWlibEpLUUM4VUl2ellsN1lEa0NvczB4bHZRSEx6eTVNZmxJZklNNzFsSmJWeWZBNzZ3ZkdpSnJn?oc=5,gnews
Solana,Solana,2025-12-11T14:14:58Z,Solana Tokens Go Live on Coinbase Through Built-In DEX Integration - Coinpaper,,https://news.google.com/rss/articles/CBMimgFBVV95cUxOSmpjMHBqVU83dE40OU5tMVZ4Z2ZYaTYybDBJNVM2TnhWT0R5YlN1S3lMNWZRZmtwd0dmeTJuMVJpN1BmdU5aNDMzZHZ2ekN1ZlVIM1BZOVNCVnNHLW1yWjJfUWlibEpLUUM4VUl2ellsN1lEa0NvczB4bHZRSEx6eTVNZmxJZklNNzFsSmJWeWZBNzZ3ZkdpSnJn?oc=5,gnews
XRP,XRP,2025-12-11T14:13:13Z,"ChatGPT Predicts Surge for Ethereum, Cardano, XRP in 2026: Time to Buy the Dip? - CryptoDnes.bg",,https://news.google.com/rss/articles/CBMiowFBVV95cUxPdGEtelZ3RHlHTndWdVo1SGZ0akg0UjRZRHR2aEZmMGZMOE1OWDhUMnV1WF9CaTg1YkQ2V3VsX3RnNlBibFpNUjlIN0xxaWxzTVl4Y3c5V2xTWDNpaVNGY3NNcjJlUG14RDdTbGUyY3hyaVFvaU9jaXdMci00NWxjQy1HVEJ2X09IZ0lTMl9tYkplQ1dMczZ4NE5sLWJwaEJrR25Z?oc=5,gnews
Solana,Solana,2025-12-11T14:10:35Z,Solana vs. Avalanche: Which Scalable Network Will Outgrow the Other in 2026? - 24/7 Wall St.,,https://news.google.com/rss/articles/CBMiuAFBVV95cUxNLUtnMFhfWUJ3S2pQc2l3OElMal8tMy00WHBTRHZ4ZDVYVV9QOC1feGdBazNkNFdlZWxVdkdLbzc3bFRBa3BJVGJpcVNKX1lPdXNsWnQyVWJqMGVoRXQ1dHhwd3pNN0F4NTQ3OGg4RUltTERSMFVweHF1MlVzdVVCTHZxNHZnN0pzZDc1WVBuTWM2ci1YVGpDSjZlQzhYUW9lM2Rmbk1ZakVVUndmZnN6RjQ2ZkxiN09t?oc=5,gnews
Coinbase,COIN,2025-12-11T14:07:08Z,"GameStop’s Q3 Earnings Reveal $821 Million in Sales, Bitcoin Losses Weigh - Bitcoinsensus",,https://news.google.com/rss/articles/CBMivAFBVV95cUxPRHJBUG00Ukk4N0I5VFNIcEUxQkpwSE9ydm1vZWxNVVhnaEl3WnljaDVCQTBxZWlQS0R2a3FNdzYyQ2stRVVfMTg5NUl3Mi1JeURfQmdlSWczUWpwQzBuZVJCY3d2SF81NVVRZXY4dlB6dEMwS0hMUUlfcnVsLTc2T2JrUWYxTDJ0QTQ2dG9PV0p2X0E0d3NlNGFJbEw3Y19mMHUtWVdvN1dOY2hmVTFralpJeWY3MWtUczZoZg?oc=5,gnews
Rheinmetall,GlobalFeed,2025-12-11T14:05:00Z,Waffenhersteller: Führungskarriere bei Rüstungsunternehmen – so gelingt der Quereinstieg,"Die Rüstungsbranche boomt und sucht intensiv nach Führungskräften. Welche Qualifikationen bei Konzernen wie Rheinmetall, Thyssen-Krupp Marine Systems oder Hensoldt gefragt sind.",https://www.handelsblatt.com/karriere/management-welche-skills-fuehrungskraefte-in-der-ruestungsindustrie-brauchen-01/100152182.html,rss:handelsblatt.com
Coinbase,COIN,2025-12-11T14:03:04Z,Crypto Lender Nexo Agrees to Buy Argentina’s Buenbit to Expand Services Across Latin America - CoinDesk,,https://news.google.com/rss/articles/CBMiygFBVV95cUxPbzd4YllublpZdUNyVmhZY01FN0R2SmZiVTl2NHJ4ZlJJMG1GcGt6SUJnX200X05IbDgyVFU3bjRwbTkxaW14cjlzZzAyTnF2SDZxZ2V0MGtKSFRrTkhxbHF0UnFfZ0tvQzUtLUJqYjRTeHNIcXFxVWprb09QWG4yUWNvQU5OVHBlLWhFdXdtcExCdmRLT2o1YnpkaHUxeDA0bTJqS2s3MlR4WllIbXpFSDYyZmR2dV8xeHZISWFETTJxR0w0MHlrQWtn?oc=5,gnews
NVIDIA,NVDA,2025-12-11T14:02:18Z,NVIDIA Corporation $NVDA Stock Holdings Lessened by Wambolt & Associates LLC - MarketBeat,,https://news.google.com/rss/articles/CBMizwFBVV95cUxPdDRYYU1hNXkzUEJsYk9VVVdUb013VHJ3b0k0YzB2Yzl5UTVhVjNOS3pfV0VOdkFybjN2ci1obTdjY2JFYVVXY3VTdGpvNDUzemRpenNQZzM3TEhvZExCYTdLVTd4aUlka25IenNiMDNjVWU2bjZKQzA2bF9WbFFjZmNUVmRfMWlfZjJQYnM1bURyQTRseVFWZ0tDRENkWkhxTWJwVlJLdjdDLWhvUkdTZk84ME5VbVRpa1pqZGliRXN2ZzkxSTV4ak9ST3hMY0E?oc=5,gnews
NVIDIA,NVDA,2025-12-11T14:02:14Z,Vinva Investment Management Ltd Raises Stock Position in NVIDIA Corporation $NVDA - MarketBeat,,https://news.google.com/rss/articles/CBMi2AFBVV95cUxPTWR1MVl2MjdZdXJGSEc0N2I1ZTduWWRuRjludWRpQWNPNGt6Q0F4OURzdlRjVjVCYUJqT0RLOWl1QjlZSXRIdjI0dlJmbmx1MmdreUtick9QZjh6QTZxWDZmSWk2TU5pWGtrRTc1YnU1bE1RM3ZXOUhYNnpGdnZUMS03OENsMTdydXJiMGVPaFFvSWtkdnVYMEJ6MnZ3bjJncHZCRnJLUVQ3anFLMEp6V3k0b00tbzRsbkNWVGd4anJnSHVYanFNTkt6WmdzemRrRzZDUDdkSTI?oc=5,gnews
NVIDIA,NVDA,2025-12-11T14:02:13Z,"Thornburg Investment Management Inc. Sells 170,001 Shares of NVIDIA Corporation $NVDA - MarketBeat",,https://news.google.com/rss/articles/CBMi2wFBVV95cUxOX3dmU1VNUDZMZHZDNmtPMVhHckdPVHJWRWJfTk81dnp6WjZDX0pONDlqQk96Q0ZnQ0dPWkNSSVV5WXdKZG5UTngteEVCMmdYeDlqT21ibkZVRFhqLWFDaE9UbVVyWXJjeU5zdkkxVkpfenZlUkY4YWpsZTlhMUhMWTJNMHRMU1p6NVNfNmw1QXdEZHdhbzhJU2tjX1BUdUg3bU15eDI4TGlpdzhQTGRzanh3eUZPM1hCWTdBU3oxRzlncUJxeXVJX09PYVhvWlRfbXdxUGFZT2lHWEE?oc=5,gnews
NVIDIA,NVDA,2025-12-11T14:02:13Z,NVIDIA Corporation $NVDA Holdings Boosted by Te Ahumairangi Investment Management Ltd - MarketBeat,,https://news.google.com/rss/articles/CBMi3gFBVV95cUxPYjhuUzFLZDVhQ0FQQmxjbzhIUTJwc3B4V0ZfdHJzSkFuSDdwY1RpaFpQZ3ZUSG1ZOUVFcE9CSXZVX2g5Q3hsNG5aOXFKdlgxRGJ2OGZwYVVRVWpOU01ZczctZFVReWN2Um5PRVBFaHJkdUhzOG5LMkVSa2FsZHFTTm11TlAzMDBoOVR2dDFrS3RBckZqNF9DWDVFT19EcWQ5clZ3MzFrTFZUSEJLZ3FCRTFJN2ZVNHFja0NlU3VKckw1OFdlQVNNdWE5QWd3ZVNHRWpCRjZaSHl2Z2E1NEE?oc=5,gnews
Siemens,GlobalFeed,2025-12-11T14:00:13Z,Bündnisverteidigung: Rutte bei Merz in Berlin: „Wir sind Russlands nächstes Ziel“,"Der Kanzler und der Nato-Generalsekretär stimmen die Deutschen auf schwerere Zeiten ein. Sie beschwören die Einigkeit der Nato, aber für Verteidigung müsse mehr getan werden.",https://www.handelsblatt.com/dpa/buendnisverteidigung-rutte-bei-merz-in-berlin-wir-sind-russlands-naechstes-ziel/100183030.html,rss:handelsblatt.com
NVIDIA,NVIDIA,2025-12-11T14:00:03Z,Nvidia Challenger Moore Warns Trading Risks After Stock Frenzy - Bloomberg.com,,https://news.google.com/rss/articles/CBMiswFBVV95cUxNVUJXcDlEaEZFQzhOVXFDd1ZJX2R0ZlRyellEV2NHazl6cWp4dlBMNzZNcURPMF9qMVNLQ080VktRVWNpTnVVT2x1bjU5Z24xOExyT1h4T2tuWkwtcEhRZU0tbDRYRjF4Wk5yTFh4VUZYbk9VUVIzNjdKdEhic0lLVWxnMGJUdkFTNDlGLXJGQTExS25hSWJ6SGhseTNCX3A3SGRrbGZmT3ZlUzRwRlJuSGwzZw?oc=5,gnews
Solana,Solana,2025-12-11T14:00:00Z,Oxbridge (NASDAQ: OXBR) and Alphaledger bring 20%-42% reinsurance yields to Solana - Stock Titan,,https://news.google.com/rss/articles/CBMivwFBVV95cUxPZzJWeVZ4b2NFdlBWMHNxLV9Iek40QklPR0N3emw3OHoyeUFEdm5PVGlSZC1yWUJiSWw0UW5pdDRIQndBYkJOcjJvQUp0dVIwcVNUa29TLTV1SlY3dW9tc2FXUVd6MHJMb2JQSklpZENVR3hsYnFtQTktRTJDbk93WjhPS21hQVl6ZURqRlJMNFJyZnBNT0ltWDF3dm5OckNWbGlfM3N6dGs2ZEcxV0JoQ0luOThEeml6bS1SemJPOA?oc=5,gnews
XRP,XRP,2025-12-11T13:59:51Z,XRP Price Prediction: Why Are Crypto Whales Quietly Buying XRP Right Now? - openPR.com,,https://news.google.com/rss/articles/CBMingFBVV95cUxPNG5Xd1JPRThjZW56T1RsRnF3TlRzQU9sOFZMQjRDbWxJand2clBHOTYyMzB2ODg5azE3Qmh4LWtmLXppaUpIdFYxMlRpUzJwcGhrV1FuLV9xbGYtQU03LUxBZW44Q3kwYksyd1k3SW12RTB0ZXFFZDNuYzJSRk5kUFlydnlqMlFFVFFBUzFFemFDcGJtaFByUGoteDJ3UQ?oc=5,gnews
NVIDIA,NVIDIA,2025-12-11T13:56:15Z,Nvidia To Regain Access to China With H200 Exports-UBS Stays Bullish With $235 PT - Finviz,,https://news.google.com/rss/articles/CBMisAFBVV95cUxPVGRKbmdtWlFjc1N2bFdFNkNxaGFCejI0UXl3QWt2b2FoVTRqUE1VWEgxTWhNREo5b2R1MFVxZll2M2FHQ0IwZ3BjZ05NbGJTUUt6X3FjRThsamF0Rzlfc252M1VUc1A0ZEhtTXVDbWRWc0I5MmlSLVNmWXBQNjV4dDRIdTNBS09CZWRhendlbEtaaE9QdTNyMUFvUUtkdVpwd1BCem1GV0lpMENKSWVPOQ?oc=5,gnews
Sprott Physical Silver Trust,Sprott Physical Silver Trust,2025-12-11T13:52:46Z,Sprott Physical Silver Trust expands ATM program by $1 billion - Investing.com,,https://news.google.com/rss/articles/CBMiugFBVV95cUxOVW1vdlJWSGF6OEtTQlM5SVJwNGlmbHREWml6c211M2Rod2RubUFEU2pSOHZpNWJ1X1VBbDV4S0FpR01EVkpXcVk4NUU2dzRyNnVqRmdtaDZQS2tmZ25CY1c4eU9OODVldS0xVzUyOG44R244cFVYWWl3ZFNtdHJ0QnFDUUhfbk1zenZCRVU3elQ2UFhZazB4eTV0bEJzSV9ibzBiVWFvM2g4UnpjSGo5dUlnRHF6MGRrdnc?oc=5,gnews
NVIDIA,NVIDIA,2025-12-11T13:51:52Z,Nvidia stock plunges: Jim Cramer warns of historical parallels investors must know - Invezz,,https://news.google.com/rss/articles/CBMiuAFBVV95cUxQejZtV3l2MjFpRDdTT2d6WGNINGFzdXNuT083eXFqWERETUdYblFFVEh2d3htemxLWXJjN3VaeEpUbTkzaWlqTFAwZU5LSGRRUHVfVHZPS05wMFNVeTRUMzhUU2w4aGVESjFEZVdWQlZLWVN5MGU5UDdxTm0tMWIxaTh4QU1ra01BdXkxZW1vRDQ4M2wzNTRoNDRXdWFzVHpzNHg3aWk4Z0RELWVqaUJqM19tX0sybS1f?oc=5,gnews
Solana,Solana,2025-12-11T13:49:23Z,Bhutan Tokenizes Sovereign Gold Reserves on Solana Blockchain - Coinspeaker,,https://news.google.com/rss/articles/CBMidEFVX3lxTFA2U1pONDd2VEE2R0JWd1drT0dyZ01OQzBwOEtaOUtaYktQdlMteTNUMEFzVjRBTWUyN3VsUWV5MjE3bkZBTnoxWlF3U19fM1VKelRRMWp1bjJLazdDSEluZGJqUWFFemlONmIxaWVNYWJVbTB60gF6QVVfeXFMT3JMNkpmU2drOE1GNEtIaDBXbHZvSzl0STNGZ1JRV0hlaDZHV1ltMnR2N2c4dGRicmo3WE1JdHRQdUZlalFnQjljUjU5anFycEtuUXpsajd5SjlGSXowakpfYlVoNk90aWtQT1V5RGpCOGgyT3Bqa2ZyYkE?oc=5,gnews
NVIDIA,NVIDIA,2025-12-11T13:47:47Z,"Oracle spending, Nvidia share price drop revive AI-bubble fears but U.S. insurers boost for Artificial Int - The Economic Times",,https://news.google.com/rss/articles/CBMiogJBVV95cUxQc2RCclZIdFhqbU9RRlRpWnlVVGpOck1KR3hsYW5DSTFvTWVpV1FfNU5CY1E2MVNoVVhVU3dnT25JY3BucDJDVGNLcUgyWlBzMjZTUEktUzk0cUQ5TTlrRGtyT3BCX0p0akNkNGFLLUEtMVQ5TlQ1b0dvdDVtMnJfV1V1enN3TFZfZzJjNG1nU3NRUjBGYXZFRmEwU1VUc0dENDBuWnA4RGtMOHc4RzQ0YW56YllRa201dWtwT3c0NkNUV09sQUpTeTltTUxkY3FmU3FfdktZUVFURi1xbl9xVlliMkN2el9yQ0UzaDhYdWt1bVZqODItcW1xYXdXWVdTTHZadFZGVjliQks3dHVQV1Rla09WOWhTbWQtblFVMURMUdIBpwJBVV95cUxOOC16YV9ITm15MEZnODg3Z1pwWV9vcDJyN3RSSk9ETTVYOXhWR3cxQ3R1NUd2a3A3TkU2dHlQOVVOY3hpd3B2eWF2OWJmQmtJQzg5T3JGU0Nvczk3WGNJUnRjTW9LTi1ZOElEb285eG9xX0lCTlUyOTZKYlJkZzc0WHVGa1dCVFFvRU1yZDAzNm9GaUJpRnJ0NVN3WUJ2VGEya19ocnktTjY1VTRnRl95WTRSZGpvNmR5V0Mtb3Jta3VOelBTY2lscm1JczlEMEw0bEsxNGRDWkM4d0xWVTNKZ2J2cURZS2pLZWdGSzZjVjJuNVlfTFZCbDhxZkVRVGJoZkExYlFzbTFEOVRwTVNCd1RzRzFJVF9ROVA4OVJPbVlKNW9uajBB?oc=5,gnews
