asset,query,published_at_utc,title,summary,url,source
XRP,XRP,2025-10-10T11:39:51Z,"XRP Price Struggles at $2.8 amid Strong Whale Sell-Offs, Recovery Looks Challenging? - Coinspeaker",,https://news.google.com/rss/articles/CBMiaEFVX3lxTE1HdFJzNXFWcWk3Q096SFpMYjlfb3UtYlpaRlY5VG5Td3FMT2VSZVMzMzhfd0ZSNXhCLXdzcjZ4OW1wRk5tNi1rRVQ0bTVhaW9lc2JvTGNJQ3VpU2F3RkZfNUxScy1BREE20gFuQVVfeXFMT1UwNWtYcmNOUUNncVZLX3dPdGotVXJxU3ZPTnFyMC1tdkVXVS1oRHk3VnlvM2wxdDd4NDV6SHdGNFVxbTlhOEhiN3dSTzhGSnpOV19CUF9qc3dXOVprSUlWRGx4UTRiT0VOQlpJVmc?oc=5,gnews
Rheinmetall,GlobalFeed,2025-10-10T11:35:37Z,Verteidigung : Bericht: Großbestellung von Drohnenabwehrsystem Skyranger,"Drohnen sind in modernen Kriegen eine große Bedrohung, wie in der Ukraine zu sehen ist. Auch in Deutschland wird deshalb bei der Drohnenabwehr aufgerüstet. Kommt es zum großen Deal mit Rheinmetall?",https://www.handelsblatt.com/dpa/verteidigung-bericht-grossbestellung-von-drohnenabwehrsystem-skyranger/100162176.html,rss:handelsblatt.com
BASF,GlobalFeed,2025-10-10T11:34:51Z,Chemie : BASF-Konzern verkauft Farbengeschäft an Finanzinvestor Carlyle,"Die Lacksparte passt nicht ins Zukunftskonzept des Chemiekonzerns. Nun übernimmt ein Finanzinvestor die Mehrheit des BASF-Geschäfts, mit Geld aus Katar. Investoren dürften profitieren.",https://www.handelsblatt.com/unternehmen/industrie/chemie-basf-verkauft-farbengeschaeft-an-finanzinvestor-carlyle/100162020.html,rss:handelsblatt.com
XRP,XRP,2025-10-10T11:33:00Z,XRP struggles to reclaim $3 as spot demand thins - FXStreet,,https://news.google.com/rss/articles/CBMiqwFBVV95cUxQMEJoX2tkSHJjLTR2aG9hNXRiQ2Q2SGFBOHJobUE5TEZ2WGd2a01vbjVnbWw5TWY5cElzOVpPNUJEdHltQXFtamtUSDUtaWtoTXBFWjBKTnFuX2pjNU42SFl3Skp3TGlTRWJUa3YwcUZaWkRuemlRMjFtbURkalh0dVpuQ205c1lHa0NJQVF0ZnFqbFBiVGVRUEJzaWNoZWJmZk5EUUp6eVVJZEHSAbABQVVfeXFMT0NELVNzN3otOHB3Z3NwSUpVQVE3VFpHbmcwaktvZXRRanZ1MUtnOVNMUmxiQXlIYXFiOVk3MzltN1AwTG9yblR3VVZTanNqYlBBMHI1U2FWN3l2dDVCdXhsSE11WXZxZDRxVUFCVDFlQXRNdlluNHhWZjNIYnl2WjliRXEzR25yeGpPQTFtWVE5UEw4RFQ5RzBOMTlVQVowNjVRdHFpek04cGk0NmtrSDk?oc=5,gnews
XRP,XRP,2025-10-10T11:32:25Z,XRP Whales Sell $50 Million a Day as Analyst Says There Is a ‘High Risk of a Sharp Correction - TipRanks,,https://news.google.com/rss/articles/CBMivgFBVV95cUxNLVdwTjFhdGVqcF96YUo2d1lhTXJVUkVOS3lvZzZIMjVvazNtcnJGOVUwRFdIejJ0N0lVcGNNTDJCaXR3ZFJpRnZ3UzhTT09xSGVYRnRrd0xOTnotd0FtM3lyc2lEakFLbDgzWXU1dG5qYm4yUzNnOENTa3Y5Q1ZUMGpMY0k0eFJpMV93TGExalJtZS16WlJ3UVh2UWV6UHh1ZWFHVDUyYzV5a0F4OVV4NTdTZ19nNTNMdHRDOGd3?oc=5,gnews
Solana,Solana,2025-10-10T11:31:00Z,Solana (SOL) Surpasses Ethereum’s Early Growth With $2.8B Revenue as Mutuum Finance (MUTM) Gains Traction in DeFi - Cryptopolitan,,https://news.google.com/rss/articles/CBMi1AFBVV95cUxNeDRVOFFHTnVMdTM3VFZNTmJaa2g4Qk5MZlB2SWNnWlpianlaNGdTX1l2LVBYLUhmVlgxUjhvUGsxMVowdGhYdmw5Qjk2aEZZTW1zYnNwaUNLT0JpcFRiSVFGZU5iRGtvNXJJQnV4ZUJycm9McUl2amVTQm9yU09ZdFdZUEc3aG0yVDktY3ljVmx5dmpUWE9QMVE5aDJkNm1aMXB5QlFlX3Y4UDd2aHBpWWJBNGJkVFl2dlZaYnlvMnVnZGRZVTV2V1ZmdGZNc0lPZTV4VA?oc=5,gnews
Pfizer,Pfizer,2025-10-10T11:30:45Z,Guggenheim reiterates Buy rating on Pfizer stock ahead of Q3 earnings - Investing.com India,,https://news.google.com/rss/articles/CBMixwFBVV95cUxQTEQ0aXc1dU1UeTVCQk5DdUdkcmNHVC12UEx0anh1Z1prZWt5Y0o4Y3NFd3Z2OXU3V0FxcEQtWjc1clUzUUtoTnhUb1l3c0FRTHNWbDY3c3VSMUNyMkNKZE1YTXZWVnF5VW5pQk80QVpsYVBpTldIdEMzVUQ4ZTBEcU54d3kxdmFhZjFXVW81Y28za2dkbkNiMUFScXdGalRxYnFNaDVxcjk5YThRYXgtYklsbDNTTjV1YjJ1d0cteG1YQTg3WWpZ?oc=5,gnews
Solana,Solana,2025-10-10T11:30:30Z,Solana Price Prediction: SOL Could Top $500 In Q4 But Only If These Two Things Happen - livebitcoinnews.com,,https://news.google.com/rss/articles/CBMitwFBVV95cUxOSGVzWXVJRExKdERLUkFwVnZIOHVHT0ZsMTM2OUh1ZFVETUNURkRIM1NJV3V3Z2V4cHFzRDJZZXo2amx3Ulp3Umk0dHlJZXFtY3ZhX0ZtbnNsVk5hVXdXdWllVFBkczNydGg4V2tON3N2X1ZTU2RqUlRocmZuUTFmVmZja054eGhuUDc4WnF6RU1Sc0NXOHBoNzBCS1plbEJxdXUtVTFEanEtRDgtZjZJN1hEdEN1ZTg?oc=5,gnews
Solana,Solana,2025-10-10T11:28:25Z,"BNB, Solana Lead Decline Among Major Tokens As Bitcoin Consolidates Near $121K - Stocktwits",,https://news.google.com/rss/articles/CBMi2wFBVV95cUxOY1pYOTRPTDY5WjhCZkNBbURBN2l1U3BrdUkyQVVPc1JOSXpSZ2duV3JqWlp2X2xYZDF1c2o4bDdycGZONFRoNWQySG0yejhvVE83eEU4bmlyTlpJcFVEOUVnamFGWTY3ZGVCUHp3djVqbUhtWjZ2UHRTNUFxcDgwd1lIZEJDZ0ZHZGw0TXhSbW9XQkNJY0tKdTZuTW1qUHNILXRtR2NyX2FKR2dubloyYzVkclFRUmNsRTQtWWhPRUNJNjE3ZGpuQWNIX0JtTXRWeFFLMS13TENwR3c?oc=5,gnews
XRP,XRP,2025-10-10T11:25:53Z,"XRP vs Bitcoin – The Ultimate 2025 Price Showdown (New Highs, Legal Wins & Bold Forecasts) - ts2.tech",,https://news.google.com/rss/articles/CBMipwFBVV95cUxNdGxCOUcyYy00czFiWUtBdDRoOU5oZU5sc2JCYmREc25jN1BOR1F4RDZMTWNSc1NIamo0NVItSWlvek5ibDNqNVN1UUExQkJ0OVlkYVk2WllwWWZMUGhTaEJEcUpDdTRQYjJUZDZicEs0cnlpZ3owdDdPeFVsQnZIdDJVVWU4Y1RIOHlWOUFuU1d2RGhRdXkyWnc4alR3MGtUVndqZmlLaw?oc=5,gnews
