asset,query,published_at_utc,title,summary,url,source
Coinbase,Coinbase,2025-12-18T05:24:10Z,Coinbase Enhances Platform with New Stock Trading and Prediction Markets - Blockonomi,,https://news.google.com/rss/articles/CBMinAFBVV95cUxQc29RQ3F5Mk0zYlF5V2wxRDV4WHBpa3NyVW5QcWdzdnBMQ1pyMzRMM2QyTTZZd0tFMDN5V2dUaF9JR0lSdFZNdVFZbFAxQTU5aVVubGRvX3BqYnRSQmFPM2tvSHgtTlFRLU14VlJrcXVsaUI1NE5HbXlBbGFndTE5Z2kwQm5tSVZyU1VfTUYtSW43REw1N2l6SDRYYzM?oc=5,gnews
XRP,XRP,2025-12-18T05:12:53Z,"BTC, XRP, ETH, ADA Price News: Bitcoin to $10,000 in 2026? It's Possible - CoinDesk",,https://news.google.com/rss/articles/CBMivwFBVV95cUxNZjl5TkZ3MjNTXzFZTVdnQk9nU0g4eFBqY0RqbE01cWVZUWZSZ2s1a2VYMFRDV3VLX0dVOTRNWXEwa1ZUeUIzdG5jMkJhUTR1dF9RZlZYRmY1OWxLQ1E5Y0puMmZuYjJzdXFKbV9EQUdmYkIwQjQ1RzJ0U0huNEowYlB3RDl1MTUxdG9PcmozV0QxWGY4TFRfWlF1TGplYjlWRUJKM2Q4MWtnajFrRVlvQWswQk1FTTA0Y1hCS2pycw?oc=5,gnews
Ethereum,ETH Ethereum,2025-12-18T05:11:49Z,Ethereum price prediction for 2026: ETH eyes modest gains while this $0.035 altcoin emerges as the best crypto to buy - MSN,,https://news.google.com/rss/articles/CBMiogJBVV95cUxPSmx0LWZhQ1VmaE0wc0VVVG9jNmZwNEh3S1lGVVRZNXJxTng1cVBScHlib292SlBudkNZUnpBbmJTRU5kNmp3WnZLR1dfOHEzbFJUeHcyRENwZ0xLU3FnRGJqdHRoZ2dpRkwtd0JmeWlHeGxQb2VUR0hyclBDUkFLV1hzQ0Rfc0JGSi10YXprTUFTeW1jTlVmYmxwUXljNFQtM0UtWG93eUlEb1RYcjBkajJ5bmFPSEVFMGM1eGlOWmxWbG1MNmN4NEcyd0d3NFJ3bWhEREg3Y2dHT1pSREF0TGtzejlMWWMySG5Zb2wySV8xbUdNdTRwUXl0TkpSSktBNDhnbXROdHdWR2VZWUZ3X2VSZDZRc2ZNZHYtbGRUeVozdw?oc=5,gnews
Coinbase,Coinbase,2025-12-18T05:03:33Z,"Coinbase to launch stock, derivatives trading, prediction markets, and more - Crypto Briefing",,https://news.google.com/rss/articles/CBMibEFVX3lxTE9HM3N1ZjhDMHYyYXVLZzYyc3Nxc1gyMzJCelowWGdBWmlsVmhLOGJGdU0zdWVYMU84LUN1VFdRaVZNSmFlNkdwSHdaOHJHYUhJSnBZeXl4X25Bd2pVb1JaLVZYUUZ0S0hZQkhYNg?oc=5,gnews
Alphabet,GlobalFeed,2025-12-18T05:00:00Z,Digitale Tinnitus-Therapie: Sonova übernimmt Silent Cloud,Der Schweizer Hörgerätehersteller will sein Spektrum mit der Tinnitus-App ergänzen. Die digitale Lösung soll künftig auch verschreibungs- und erstattungsfähig werden.,https://www.handelsblatt.com/technik/medizin/inside-digital-health/digitale-tinnitus-therapie-sonova-uebernimmt-silent-cloud/100184516.html,rss:handelsblatt.com
Coinbase,Coinbase,2025-12-18T04:46:41Z,India clears Coinbase's minority stake acquisition in CoinDCX - The Block,,https://news.google.com/rss/articles/CBMieEFVX3lxTE9YdEJSN01EWkdVc1IyeTQ0c1hlcEdzR1BHRmh1S0N6OU5zM1pmQm1POUNqdDFBZWpRdlNCWWZoVFRCRjRrVzFwLTlaVWVSSnV3eXdvOG9weUhEQWtDNXBsQXRNS2VEdUgyY19tcTFibWxlNVFVQUw0eNIBfkFVX3lxTE1VUnFuTHd4UHJOMUt2TVpFblJ3RmlCZ1NhRGR0TkRDOGNYYlNYRmkxRHZyUTQ0VTBaaDIzY2VmekFMa1JYYzAzd2dKM3BfXzlWdkE0cDB5VjRGYkZWV3dzaGk3cmdiZ09HRXZNTDVmT0JPWEg4SkRtbjhUOUdPdw?oc=5,gnews
XRP,XRP,2025-12-18T04:44:00Z,Ripple News: VivoPower Eyes Nearly $1 Billion in XRP Holdings in New Share Deal - CoinDesk,,https://news.google.com/rss/articles/CBMivgFBVV95cUxOSjIwZXBQSUVZOW9FcU5KUkRKMlJvdTl2VllDd0o1SVc5MkF1eWd1RTBXTU9ST3pVTElYR3dYRWhkbWtpbU1meGVFaHE3Nzc2ZFNBQkxJd0p6N2xlLVpmYTZZLXJ0dlh2VFU0dm9PbmQ5dXM3TVlCTzFZNEtJNDBhLXd2QkFVSC1XSnVHX3ZVWElINlAyM3RaUnBBQk90blV5c2R3UnJqRTNKU290VnBqTW9ManRMLWhzTGxwRUx3?oc=5,gnews
