asset,query,published_at_utc,title,summary,url,source
Bitcoin,BTC Bitcoin,2026-03-21T07:36:37Z,$42 Billion in Bitcoin ETF Volume in 48 Hours — Here's the Reason BTC Price Isn't Following - CCN.com,,https://news.google.com/rss/articles/CBMilAFBVV95cUxQT0hPNF9iTlJBdWJaY0ZvUUpDYW00Q3Jubk45MTR3NzFRN2prOE9JNVFQMVFsMFN6ZE1MWHhyeng5aVpLRUFJX256X3RlUkxHZGUteUpOOWNreXVWY3Bnc1RUMTFvak9uQnFNZmhsV3ZUQlpOTEFjTUV3MVpreVJkZEdHNE1QckxRX0ViUUJDWVlwNkRN?oc=5,gnews
UnitedHealth,UnitedHealth,2026-03-21T07:32:40Z,Aventura Private Wealth LLC Makes New $1.90 Million Investment in UnitedHealth Group Incorporated $UNH - MarketBeat,,https://news.google.com/rss/articles/CBMi8gFBVV95cUxPeE52dWF6bjB6bXUtNTg1ekd4emp2LUQzSVlpSzZWYzMxQjlRT1ZUbElTY2EyQTBZTUp2THVYRFB2SEo2MjRIdkdmYnFvbWNLenh1dUZ5OXBtQ3BycHZxamZhS3dxdVczdGI0WHFfcDdDWGk0bTA5M1Z1VzR4R3Q3Y0ktTW9hZEk1VFF2TFVNY0J1U3hwZEhZM3lhZkhYTy1JaHdicUVRMmd0ZlpKNVo5NW9aVDNVMWl0bFhiYmtiT1kwMW05ckMzN1EtcXhLVHZOTTFpWGJiRDB4UnM3c0h2R2EwbjNzOWswRWRUQUhOMmpFUQ?oc=5,gnews
NVIDIA,NVIDIA,2026-03-21T07:29:43Z,Prediction: This Will Be Nvidia's Stock Price by the End of 2026 - AOL.com,,https://news.google.com/rss/articles/CBMihAFBVV95cUxPQVd2a1VueXlweDJXYzZod3FjR05zOXEtTVM5bG1OTkp5LWN1ejAwVDlveHpfY1NPQXlrYlNtYU95d1llamRlUi1ZVTFmUUU5djB6TUw1NnQzczBYRW50Z1A2NTE4TGlmMXNkX185ZFpycTV4ZVdpdzFRQXdxbmNQTzZ4X0E?oc=5,gnews
BP,GlobalFeed,2026-03-21T07:28:03Z,In Gelsenkirchen: Warum ein US-Milliardär eine kriselnde BP-Raffinerie kauft,"Der Ölpreis steigt, Versorgungssicherheit ist ein großes Thema – und die Chemiebranche ächzt. In dieser Lage verkauft der Ölkonzern BP eine der größten Raffinerien im Land an einen Investor. Was hat der Amerikaner vor?",https://www.faz.net/aktuell/wirtschaft/unternehmen/bp-us-milliardaer-kauft-raffinerie-in-gelsenkirchen-accg-200654779.html,rss:faz.net
Alphabet,Alphabet Inc,2026-03-21T07:22:18Z,Advisors Management Group Inc. ADV Has $11.59 Million Holdings in Alphabet Inc. $GOOGL - MarketBeat,,https://news.google.com/rss/articles/CBMi2gFBVV95cUxOeGRmbmVyRzM2ZE1vbUxaTERnTzdEcWtvTWtlTUNaNEVNTC0weTBTZFJ6eGJXNkgxdnJ4LU5IbGw3eVpBZjEzWXdWN05iRUFSR01DTExzQ19zLVZ5c3dkemJDcmQ5NVRRcEVZR0kyUXdYdm1CaXBUQmNTZTJ3NU42cmJCVy1qN2tNZ2NMRHVPbzFVd1ZGNzkyN0trWUx0a1BkOUZxZXIwM3o0bUNyTTlVVjhiTGRRV29wb2RhTWpFa1FtYzVyVTBzb1J1clZLbGZVN29JSEI1bUszdw?oc=5,gnews
Alphabet,Alphabet Inc,2026-03-21T07:16:16Z,Alphabet Inc. $GOOGL is Alecta Tjanstepension Omsesidigt's 2nd Largest Position - MarketBeat,,https://news.google.com/rss/articles/CBMi0wFBVV95cUxQY1pQQVJzMTFxV3lTUEpEQUZFU1k1SjR6V1hiZkN0VGExSEhxWFlncWlnYkpSaXpzY1dvdzh5NkFSNVIyTkVsV2VGeERBQi0zQWVpUndpUzVHaXlMeWx3cmVKRVZKZTNaNER6U3hPTmo0cV9yV21zdVZPbzQtVHRQRElrTXZnUDNtZGNfSndpUnFQb1NjdEZfblB3YXExRUhaLVg3RDdqTE9fU0pYczcxRFJJZDVQaEMyakV4bkVnM3RuX2xlR1R6bU5PTGJqTnpyZlk4?oc=5,gnews
Siemens,GlobalFeed,2026-03-21T07:15:32Z,Radrennen Mailand-Sanremo: Warum sich alles nur noch um Pogačar dreht,Mailand–Sanremo war lange das Revier der Sprinter. In Tadej Pogačars Radsport-Welt haben sie kaum noch Chancen. Doch seinen Reiz verloren hat der Klassiker nicht – im Gegenteil.,https://www.faz.net/aktuell/sport/mehr-sport/tadej-pogaar-bei-mailandsanremo-alles-dreht-sich-um-radsport-star-accg-200653900.html,rss:faz.net
Alphabet,Alphabet Inc,2026-03-21T07:12:16Z,AIA Group Ltd Boosts Stake in Alphabet Inc. $GOOGL - MarketBeat,,https://news.google.com/rss/articles/CBMirgFBVV95cUxPVVJRN3NZd21iVExlTmRtSE8xMjJMOHlkbmV4UjZFWG5fQ1lrYmtCVnZLQ3NOQ3hfdUpiRFFOYkZ3QURKWG5hM1JMT1VoWndiYkRMd2ZuRWwzbEhvbVoxWXoxS1B1T2RaQURWWGptZ2tQNlNlUXZ5SzB5eWpIQTRWRFhJNkQ5WGVWQ2dOM0w4X1FibFdTb2pwSHJBbkI2Qzc3U1NmNm9FWGJsRnRSVXc?oc=5,gnews
Bitcoin,BTC Bitcoin,2026-03-21T06:58:34Z,"Bitcoin (BTC) Price: BTC Falls to $70,000 After Fed Signals Fewer Rate Cuts and Citi Cuts Forecast - CoinCentral",,https://news.google.com/rss/articles/CBMiugFBVV95cUxON0c5di1QYkstYjBTNC0xMU4tVGYxY2RtZGhwLW1jZVZvS1pYd18yUW4zNHIyOTFteDNTUHZHV2F6TnptdDRnSG9YVFk1N3N6bzQ2RzVDQW5wbVZCTEU5emZIeURiVGs2Q0I3SGJjMEVKZmFDdVY0bTF6dVB6dzQyb2Nfcy10THNxQzBVczZoWFBobjlEVE1YZkFTVHF4MXptWHd4Vm1tTzdHZ0ZRUWZnd2tLOGhoX0JmaUE?oc=5,gnews
