asset,query,published_at_utc,title,summary,url,source
Pfizer,PFE,2026-03-17T05:46:20Z,Should You Avoid Pfizer? Here's the Key Risk to Watch - The Motley Fool,,https://news.google.com/rss/articles/CBMikgFBVV95cUxNUldjOTQwanNHRFlvLVpjYy1hSHFSSTk2SHdLQ1ItVXYtMFJnN2ZnUHdVcUhxclV3clg5b3dtNkRLVkRMQWxHMEZCaE5tRFZjOFRYdEQ2eW1oZ0VQd2JkUkxyVHFXTTdGVGpNc3NzQ2tVSkhIeVI0LXgtVUt1T0JGeVhsWkVkMEQwUlBTVXRQaUk1dw?oc=5,gnews
Solana,Solana,2026-03-17T05:45:59Z,"Derive Integrates Solana Markets, Enabling Volatility and Structured Trading - Cryptonews.net",,https://news.google.com/rss/articles/CBMiV0FVX3lxTE02aTdrbW5MTE5mbGpmOGJ2OFdGVGtCYlFXX1k2c3l6ZmdzS0xrWjN1ZlNqWkV2S2g0S0VjMnc5RE9hNmxLWWhjZXMxODNmNFZnVVBKU0RITQ?oc=5,gnews
Rheinmetall,Rheinmetall,2026-03-17T05:43:29Z,Investor Enthusiasm Tempered Despite Rheinmetall's Dividend Surge - AD HOC NEWS,,https://news.google.com/rss/articles/CBMiwgFBVV95cUxNaUxOejlpMzl0MThlZThjMk8tLWE0VVBjZXNqRU5nZE9HaE5sR3JURXJSUnB6a3dLS3ZTVmVwZVl4VnpvUmJWUlRFVkV6UHZnTU1FaVlNYTUyVmN2YVM2UUZuN1NMRWxRT2RUTHlnRjJOZUM3QzUzdXA2dHFTTW9VeTFjbFUxN0Fya2h1TkVsaEFVcmI5ZWVwZExVa0lVUC1mdWRKcVVkQkxsNTh2bFJDNU5xRzRzREtCUHVtZkFCVDJZUQ?oc=5,gnews
BYD,BYD,2026-03-17T05:43:29Z,BYD Shares Surge Ahead of Key Financial Report - AD HOC NEWS,,https://news.google.com/rss/articles/CBMiqAFBVV95cUxNTlJGTFZ0N0NtUE1ESlZOQjRQQ2dMekhJX1pxMThOdFROZDBrRHZwVXpMMjJaeWFaODJuV04wQmJPcmx6QU9neHZNY1FrakxFTGZMZlBLa1p6TjlNNzdlem9xY1dNa013dHRpNmEyQmtYalBNck5YXzJKNU1iZElEa0tmXy0tejZUMW4wM2pKM1hzaTE5anFDbENOYnJHOUc3VngyUHF0dzk?oc=5,gnews
Siemens,Siemens,2026-03-17T05:36:29Z,Siemens Ltd. is Rated Sell by MarketsMOJO - Markets Mojo,,https://news.google.com/rss/articles/CBMipAFBVV95cUxQNnJiQ0dRR0NvNkJNSk9vRXpXdVhjYVFpdTFZWEVRWVRmWVZqRmFveElKcW9xY0IxYld1RVkwc1FFVjBxNTZnQnJjRHQwZFFKZnFFZlM4STVUQmx5NEJlaXI2X2J1Z2pTck9TeEFkbzh2T0RibkE1MTNIVUlHeWMwaEMxc0VZN3RYelJvMk5VOG94X1BGMTJmNU5kQlFLTzZuakozQQ?oc=5,gnews
Siemens,GlobalFeed,2026-03-17T05:32:53Z,Krieg in Nahost: Die Zerstörung Libanons nehmen sie in Kauf,"Libanon ist zum Schlachtfeld zweier zu allem entschlossenen Feinde geworden. Die Hizbullah will lieber untergehen als aufgeben, Israel droht mit hartem Vorgehen.",https://www.faz.net/aktuell/politik/ausland/die-zerstoerung-libanons-nehmen-israel-und-die-hizbullah-in-kauf-110854528.html,rss:faz.net
BASF,BASF,2026-03-17T05:25:46Z,"Pre-market Top Loser BAS.SW 17 Mar 2026: BASF SE CHF40.80 on thin volume, watch catalysts - Meyka",,https://news.google.com/rss/articles/CBMitAFBVV95cUxNbW9VdGJ6ek9CbTFGTGpFdzJabGxnYUZZckNKejhjc21ERFBCSkRVZGdaSmtzM1UyaWI2b3NGTUtWb3JQN1h0M1h5ekk3VUlKQVJ1eEJTUnJoMmdhVHd2VU5yU0dtekVkLXdEZ09WU0lPTzh0U2wycUdGWDl4c09TaktPYnY1WEJvbXRUNDhEcU1GaWtxN1ltcU1jdGhMMG5yOVZnY25OaUthRW9CV3pRS3QxVE4?oc=5,gnews
XRP,XRP,2026-03-17T05:05:40Z,XRP USD Rebounds 5.4% as Technical Signals Shift Neutral - Meyka,,https://news.google.com/rss/articles/CBMiiwFBVV95cUxPMVVnRENyWkZUNS1vb2lVT3JheHFXTmdEZm1abGRSTERfeC1sSzA1dHNrYmViV25wbUJzSThWRm5SVzlsUXVNUk9JSnFJN1pNVUlxcm1sTXVWTGJHcUNiak05WWpZNHpVd21keDhrbmhMVXlSZmVPUnlSTzJWWXNmMmx5SlktWVAyQ2Vv?oc=5,gnews
