asset,query,published_at_utc,title,summary,url,source
Alphabet,Google,2025-09-09T03:00:00Z,Google has emerged from the brink of forced sale of web browser Chrome. U.S. District Judge Amit Meh.. - 매일경제,,https://news.google.com/rss/articles/CBMiT0FVX3lxTFA3cXlXbXJRX3k4Yjg2ODZzbV9MQXA2WVhtWnU2NWFkWWt1cmlqVU5ZSWNOb1dDbFhINFM3aHdRVjQxaXQxU0x5djlzTmRTZ3M?oc=5,gnews
Solana,Solana,2025-09-09T02:59:55Z,SwissBorg Hack: $41M in Solana Stolen via Kiln API—Will Users Be Repaid? - CryptoRank,,https://news.google.com/rss/articles/CBMiqwFBVV95cUxOdTFqSVlNbXNmdDNlZFVOV3ZVWTJKY2Z0T2xuTVA1Z0xtdHBVRVloVUhBR3ppVDlvWnRZNkZUUkgzOTlWV1JRMUZTaFdObWF5SXNuLXhFaXpjd09TU3dxYTVaM3VxMjNzY3NDQy1mVlN2UjJZRF85dTJlcW0zY1l6LWZTM0dLeWg0MzVjZ3FKdV9yNVhtWGlGaDlmUTRXWC1zOVliQUpvSHZsYUU?oc=5,gnews
Solana,Solana,2025-09-09T02:47:30Z,Solana Price Prediction From Top Crypto Analysts: Could A SOL ETF Be Approved In 2026? - Crypto Economy,,https://news.google.com/rss/articles/CBMisgFBVV95cUxQQW05OWpjYnRZR0NycG5VdGZNODgteDlyQjd0amNIeno3YXh3dFF3aWp6WlFvTUZDbE9feWgxakF1TXA2RWVmbmlFbDdyNV9YVl9RbzF4YjNwUjJLQW5xU0d5LUVMU1IzZnMxTzBKTjJoU1RjSDVIeXUwbTMxX1pXaDh4NXlLWGRGS0FTZTM4SVpoQ3hXclVMaHZLUWVlUnkwNlBuTlFOVW9YVDlDNURwTzhn?oc=5,gnews
XRP,XRP,2025-09-09T02:35:54Z,"Bitcoin To Hold $110,000 Through September, Analyst Says—What About Ethereum, XRP, AVAX? - Yahoo Finance",,https://news.google.com/rss/articles/CBMiggFBVV95cUxNZDRoVU52RnRneHllMFlLM0lFdFc3WE5Ba0R5aU9DU1Fzd011Sy11cGJYUzJHYWFwTE9YYkNjbkE5NHcxeVZQd0h3NUNId0pIbFMzV1RaZkhDWERoM2lUMXk3WmFuNXBOck53enlLdDVxc3hCVEpMb2ZqS2NLMGsyUzhn?oc=5,gnews
Alphabet,GlobalFeed,2025-09-09T02:11:54Z,KI-Start-up-Serie: Codesphere fordert die großen US-Cloud-Dienstleister heraus – mit günstiger KI aus Europa,Das Karlsruher Start-up stellt Entwicklern Rechenkapazitäten nach Bedarf bereit. Das spart Kosten. Dieses Prinzip will Codesphere nun auch auf KI-Anwendungen übertragen.,https://www.handelsblatt.com/technik/ki/ki-start-up-serie-codesphere-fordert-die-grossen-us-cloud-dienstleister-heraus/100140536.html,rss:handelsblatt.com
