asset,query,published_at_utc,title,summary,url,source
BYD,BYD,2025-10-23T02:56:39Z,"DBG and BYD gain ground, but Dixon and Bhagwati Retain Lead - Communications Today",,https://news.google.com/rss/articles/CBMingFBVV95cUxQRnZpOHVWYnJNd1UzUDF5VC1XTmJOUk9hRW5teUVuTENwSXVFUWpKWWRGVEFqU3VReHRyZ3ZfQzNoSy16UC1aWS1ZZkN4dWF1WkZ3Q1FjT0d4b2FfQnI0WDJNMXFtREFWSy1tcnh3V19GZldmNUdEX0Y0OGV4S1JpdkpOU05SWU4wbmJvVU54TlI3UTRPb0diQy1rV0FQZw?oc=5,gnews
Coinbase,Coinbase,2025-10-23T02:31:44Z,"BNB Breaks Barriers With Coinbase and Robinhood Listings, Boosting US Access - Bitcoin.com News",,https://news.google.com/rss/articles/CBMiowFBVV95cUxONDhaM1U5dk44VTRBbVdGV1ZrYms1Z09KbUNsckFIUGtRTFNuNnZsVUh4djF1WXprcm1aZzVfRE02cHNESExDWV93ZTdiZndCTWE3RHpIdzNsU2dScTdpLXUybkNkM0RsV3dEMHZ4Ujh6cGVpV3Jya09rRnFLQ2JWbmFTYmhkOHMyb0w0UF9VSlgyV2pnVnZuSmV6NW9ENGdFa3ZN?oc=5,gnews
Robinhood,Robinhood Markets,2025-10-23T02:31:44Z,"BNB Breaks Barriers With Coinbase and Robinhood Listings, Boosting US Access - Bitcoin.com News",,https://news.google.com/rss/articles/CBMiowFBVV95cUxONDhaM1U5dk44VTRBbVdGV1ZrYms1Z09KbUNsckFIUGtRTFNuNnZsVUh4djF1WXprcm1aZzVfRE02cHNESExDWV93ZTdiZndCTWE3RHpIdzNsU2dScTdpLXUybkNkM0RsV3dEMHZ4Ujh6cGVpV3Jya09rRnFLQ2JWbmFTYmhkOHMyb0w0UF9VSlgyV2pnVnZuSmV6NW9ENGdFa3ZN?oc=5,gnews
Coinbase,COIN,2025-10-23T02:23:08Z,Melania Trump Meme Coin Lawsuit Rocks Crypto World - Evrim Ağacı,,https://news.google.com/rss/articles/CBMijAFBVV95cUxPdjJ1aDNKbnRWbDg2d05xVmc2R2RQR25CenEyX2ozZ1Y1cS1QSHhwODF3cVN3M2lNU0tzcEFMYVlvTGdZemtuMmtMQ1ZOMzZxUGIzWV8tdUoyTDJ6RlkxTi1aZ1pCT2JmcVhOR0tpam53TXI2OXRZeEVZSjAxNTZIWGtEam1jMXgzTDR6Zg?oc=5,gnews
Siemens,GlobalFeed,2025-10-23T02:07:16Z,Automobilindustrie: Schwarz-Rot will Kaufprämie für E-Autos wieder einführen – Mittel- und Geringverdiener sollen profitieren﻿,Die Koalition hatte Hilfen für die E-Mobilität angekündigt. Jetzt werden die Fraktionen im Handelsblatt konkret: Eine Kaufprämie müsse her. Zuspruch erhalten sie aus der Wissenschaft.,https://www.handelsblatt.com/politik/deutschland/automobilindustrie-schwarz-rot-will-kaufpraemie-fuer-e-autos-wieder-einfuehren/100165953.html,rss:handelsblatt.com
