asset,query,published_at_utc,title,summary,url,source
UnitedHealth,UNH,2025-10-21T15:44:01Z,Wall Street Bulls Look Optimistic About UnitedHealth (UNH): Should You Buy? - sharewise.com,,https://news.google.com/rss/articles/CBMizwFBVV95cUxPeXBCUUpnV3NxTmk5UU5WSks2b05TQUJtN2xnQmhiNFg2OU5tdThuUnJEQjVUeUZ4S3N4eFc1MnVZV0loUnBJeDlzdGs3NlRHSTNJRXdsMDBDSl9hck1GOTUzVWVLQ1VjSUE1YTNwVkZ6UF8wUk5jTDdLQUVQUUgwZXRGbzdiSHhIQ0tZSTY0NkZLZUlpUmdGNkotdWlHZHJMQUdUQjZ3bm5Sc1RlVzRyWnpJbUI4MWhVYnBhMFhPYWFwTjBpdmlQUGVnai1wZ00?oc=5,gnews
Coinbase,Coinbase,2025-10-21T15:43:19Z,Crypto Currents: Coinbase acquires Echo as whales move to ETFs - TipRanks,,https://news.google.com/rss/articles/CBMiqgFBVV95cUxOb1laeEtNQWNoc0hJZlFkeVhKbmxGeV9nMVY2b2VPbFdWYUZzS3RSalN2ZGlrdVFVS0FyaGNJdGw5S0N2d0hwcjdlTGh2U2l0Z0ZQOUpqZDdEd3NUUkVSem96dzNBNmFHeW9INGNNUVZ4S1Bia3UyZDM0QTVRcDV1cjBpaVNKSmR1QzlQN0NuTmF5Xy0xSGh6eXB3bDc1SUZ6bllQWXJnd3p2UQ?oc=5,gnews
XRP,XRP,2025-10-21T15:39:44Z,XRP’s main rival in 2026: Who really threatens the king of cross-border payments? - EU Reporter,,https://news.google.com/rss/articles/CBMi1AFBVV95cUxNZUw5V2IxRjF0eGM2NFBEdWswdld1Ym1ycUwwdkpkVkhXTzhLcVNrbXg0ajZXV1lKcmhsdVIteG1UcXpzZ0Jac0VGY0dkMk03R2VZZmphRzdKR1dhQTRyVnRzenpxWWQ1R3haZm9CdlF4WW1MNTQtWGZ3UU9ucXZHQy1FYkMyX05yREE3X1dnVnVYam5Rdk1WR0J5M0J2ZG1Bc3NwWlVrMHNMbTc1TGNNQnVDMmNuMnFmMHg0WkRmLWlsWUthQkRiV0xjaTRybjVTSlBzag?oc=5,gnews
Solana,Solana,2025-10-21T15:32:13Z,What is the Solana Edition Credit Card? - OneSafe,,https://news.google.com/rss/articles/CBMif0FVX3lxTFB3SldKME5fQTVXZjBUUjIyTGw2UnBaN1FPLUVfQTh4Wm9hWHRwMFBpYXJPNzBMS2dDcXlITDRRbXJJYmx6VkJxdGRpUFBVTjBvVGNNWkgyV3BHM3BHWU5rUzcwX0dqWXNwbmZxSl9kcGtYWHc3TU5DMkNZQ29CZG8?oc=5,gnews
Siemens,GlobalFeed,2025-10-21T15:30:29Z,Künstliche Intelligenz : „Ändern das Betriebssystem“ – Siemens-Chef schwört Top-Manager auf neue Strategie ein,"KI sieht Roland Busch als Jahrhundertchance. Er kündigt an, den Dax-Konzern dafür tiefgreifend umzubauen. Was das alles mit Lego-Bauklötzen zu tun hat.",https://www.handelsblatt.com/unternehmen/industrie/siemens-ceo-busch-schwoert-manager-auf-neue-strategie-ein-und-baut-lego/100166406.html,rss:handelsblatt.com
