asset,query,published_at_utc,title,summary,url,source
Coinbase,COIN,2026-04-25T23:38:10Z,Morgan Stanley Adds Stablecoin Fund After Bitcoin ETF Launch - Bitcoin News,,https://news.google.com/rss/articles/CBMijwFBVV95cUxPY1FkX0VFUnNvQXotTGFDejJ4aHNuajBoNnBpcmhPOWE3eDVsNDhEbkxkNmtkWEpyRFpYckJiWmxXM09JQ1ZxWmZXbTFlV2FwNmpCSkJsRTRZZU5qRDg5ZEpDNDktZjd6bWsycmctR1R5ZHVCWWVqWHpoMXM3RFlLVHRzXzdUZ3BCVnVzaGI3VQ?oc=5,gnews
Coinbase,COIN,2026-04-25T23:19:00Z,Trump says crypto was created in America at Mar-a-Lago meme coin event amid community backlash - Cryptopolitan,,https://news.google.com/rss/articles/CBMie0FVX3lxTE1FbUZodDRMb1FRMnJyVjNVNlZwd1dZTU8zejF4cm9tRHVGcElmOXNWU0JoTG0wcG9HSTlrU1NXNUkyMnI0WXZOclFfMzNBVjlhdk5MeWdjeV9yeDE2MVRaS3hObEU5b3ZWU19YZzdJYkQ3SGNGazJ6SXY3OA?oc=5,gnews
Coinbase,COIN,2026-04-25T23:18:37Z,After the TRUMP Token Slide: What Political Meme Coins Reveal About Crypto Markets - Yellow.com,,https://news.google.com/rss/articles/CBMigwFBVV95cUxOOGpwcWpjYXFMSmZDSWRDTTgzRl9BUzVadnpHcmhzeU0yMGR6M0RJa2JwMTB5UTlDLTAtY0Z2STdEellSaDNwbnFMQ0RDSUFNYS1HSUgwOFhuSDBrdG43SnBwWEhIWWt6ZDRDdUFweEdpdTZvNlNBLWR3YUpiNGFTRVRQOA?oc=5,gnews
XRP,XRP,2026-04-25T23:06:52Z,XRP Price Prediction: $1.60 Target Within 30 Days as Institutional Sentiment Shifts - MEXC,,https://news.google.com/rss/articles/CBMiSEFVX3lxTE5jZnBaNUEwZG9YNV83RnNFRS1SNWN4dkRpUlg3eVl4Yzc4TjZYYlp0LTBSaGhmaDNZTW1aakRSaUI0cTNDdlBZZg?oc=5,gnews
VanEck MOAT UCITS,MOAT,2026-04-25T23:04:08Z,"Coca-Cola Earnings Preview: Moat Remains Robust, Defensive Attributes Regain Investor Favor With AI Support - TradingKey",,https://news.google.com/rss/articles/CBMi2wFBVV95cUxQQ0FQTVIyTlFvLVZZRFNXVzdCalV4ZDltOGdqWDBkUERZdDZ3dk8xZmpxcGNiNEZ4N3h1MlF2RFV2Rk8ySVY4aTR1TDVnNGU5WFpSdlZUWXNHclMxRGJMc2Zvd19wT3pRZ2cxZ3RhVTJwdHJXRUJhQ3FDWk5nc3h2YnFMT01sdnc5dW1QM1BkLVM4M01UR2N2TWpjcU1tc2JjNlpMcXFqRUZIbWh2cHp2cF9LX3JyYVNubG15QUVrYWxOUGNmRklzanBfcHVCMHJRZlk2SGI4cFNWV0k?oc=5,gnews
