asset,query,published_at_utc,title,summary,url,source
D-Wave Quantum,QBTS,2025-08-28T15:27:42Z,Chart based analysis of QBTS trends - 2025 Institutional Moves & Reliable Breakout Forecasts - Newser,,https://news.google.com/rss/articles/CBMicEFVX3lxTE9paFhkVlVCSXpNRl94VVJTMEN0VUN1WWJ1WUtEUTB5RUNQWkFlV0w3SXh6VmlKbURvZVBCckphWmgzOWZyblFfNm5XTXhaWDdqSmh6R25jQmxHT2FvQktpWEJRSmFOdVJXckNpcXdiaWI?oc=5,gnews
Coinbase,Coinbase,2025-08-28T15:27:36Z,Is it time to cut losses on Coinbase Global Inc. - July 2025 Review & Entry Point Confirmation Signals - Newser,,https://news.google.com/rss/articles/CBMiigFBVV95cUxNSGRqZ3JWLTFmY2J1bnU1MHBibGJtbjV3LXBtWDF2OFR5NXA2T1paOGFzaDVTSXYxQlp0NE9lQW51RFVQb1VVOXpfb2lTdTF0ZllSWFJkSWpySlphY25FUmk0Wm9Md2JheUl3V3RPOGw4ZWVtV1lVTms2Ym14dGppT3ZpbFhfRDYta3c?oc=5,gnews
NVIDIA,NVIDIA,2025-08-28T15:26:00Z,"Stock Market Today: Nasdaq Up As Pure Storage Rises 30%, Triggers Breakaway Buy; Nvidia Cuts Losses (Live Coverage) - Investor's Business Daily",,https://news.google.com/rss/articles/CBMixgFBVV95cUxQa19tS0JGYklPVHQ5ZzQ1UFdhY3kwX19HaXZ3U2N0eE5JWmFIV29YX1ZWZGY3d0g1ajREeDRmMVRaX1lpWmFHc0lMWmltZmllaFQwREl2eVVRQUtRbHd3dlo4REhvbzM3dWlsNXBEX3Z1Q0pnemtWWTNUbldJSmVoYU9DQXY3cm5CTE1Pamp5RjFlTjlmdG5mM2tHc01YeHQ2WHBaZGlJeUs5Ty1KTUp0R0t5bmdoOTU1RkVCOVNtZzBORzlmalE?oc=5,gnews
Alphabet,Alphabet Google,2025-08-28T15:22:54Z,Alphabet Inc. stock trend forecast - Volume Spike & Weekly Watchlist for Consistent Profits - Newser,,https://news.google.com/rss/articles/CBMidkFVX3lxTE5ZM2F4UDJSRVdnTldqLVJVUUV3M1F4U0JsU2pLeHNUbGs0ZGEtdS1NQ1RrUmtUV29IdkZ6NVVUTHB3WDBiV0lDOGRsMmJyUjE1VFRhMzQyOWE5aDN5LURWMXczaW1VUWhnUE81eXN5dGhESWJuTVE?oc=5,gnews
Solana,Solana,2025-08-28T15:22:00Z,"Ripple, Solana & Remittix: Top Crypto Analyst Predicts One Of These To Rise Over 4,000% Before January - Cryptopolitan",,https://news.google.com/rss/articles/CBMixgFBVV95cUxOVDF1anQtRFJmbzVOSk05bVlWU0QxT1hxR25nZHNxTlZjbTgzUm9kMzJuc1RKNHZGbGhvMTRCSUd1Q1pkenBpZXVwYUdacXJvUnZGdk5jVGlJWXN1b1c0Q3VLVlE1Z1AyV2hWOXZWVVZCMXFWTUNTOUJpVW9jWWhGT1V2Uk00LVEzMmthMDYwVG1kT1RNbVJqUk1fX3UzY0wyNVBXWEVKRFpNUU1VN0pKdUQ4X2xPdzVsbXQ2UlNvcTl1a2tINkE?oc=5,gnews
Alphabet,Google,2025-08-28T15:20:32Z,"Google Pixel Tablet Falls to All-Time Low, Likely Clearing Stock Right After Pixel 10 Series Release - Kotaku",,https://news.google.com/rss/articles/CBMiyAFBVV95cUxQYWFzQXZWcWo4cXp4UmU3UWZMb0R3dzhTeGFuZlpTYmRBb1dxUVk1SlhEVXRMUEZlYmQ1UGJfbFVWaVVOV2UyenNfMGN4eUt1TGNaOUY5MUdycDZzMVZ1RjZyazJOekpQbTB4V29KM3ZFNWJCLTNEVW5IbWZ3UWw3TnpLT0QzX2FfTFRETEhXbzV5Z0NHamdZMWx4NnkzaU1fMXIxSVdPWC1vQTd3QjVJR1ZJZGlidUVEYmxldGU3cmc5ODhUMXp3Qg?oc=5,gnews
XRP,XRP,2025-08-28T15:19:15Z,ZachXBT brands scammed XRP holders ‘exit liquidity for insiders’ - Protos | Informed crypto news,,https://news.google.com/rss/articles/CBMiigFBVV95cUxNaHZYUFZLQks5c3pBc1BVbDRKMzJ2b1BHbmQtWG1ibGs5OUdRbWVfOHRlQzJiZ2VSelpZeGRwR0V5VG83WndhbDgzZWhvRGlMVndmOVFvdkRhcVF4ODNWdFhPVkRBX2FUQTlkdG02emphYjNDU2k3VXF4MGZzOUdpODJuTk83a05NNkE?oc=5,gnews
Solana,Solana,2025-08-28T15:14:35Z,"Sectors Beyond Bitcoin: Ethereum, Solana and On-Chain Economies - CoinDesk",,https://news.google.com/rss/articles/CBMiqwFBVV95cUxORHpXZHdZZVhHdW5qYXNlNzgtalFHdGpTQVBRNG0tb3NtU0daUERJTVA2a0ZfM0ttLWFWWlBBLXJDU2JEUFBCaUZJcnlaMDlpZjdHcnV1U2c0Nkw3Z0pEd3Rzc09wckNlWjNUR3gteFI2aTVrRjF5MXYzRE02S1ROc3hmVUt0d3RubS14Z2dpR2pPUTZHdVFkUWk2YWxHaWsxZmJCWDk5V18tRms?oc=5,gnews
Ethereum,ETH Ethereum,2025-08-28T15:13:22Z,"Spot Ethereum ETF Inflows Flip Bitcoin Once Again, Will ETH Outperform BTC? - Mitrade",,https://news.google.com/rss/articles/CBMigwFBVV95cUxQSlpGRl9waWFZUFg0b2dhWmdYLVlFMGtQWlFPOG9EcEpibG1rVTQ3RVJIYlJsaWcxaV9yQUFmWWRVRGgyWEk4c3pqSXBweHUyem9GWjBYRl8tSDR4U1hIajFEX1ZUOEYwNmoxOGxYajJKQm9aTFVHUTdwQzU0a3ZQdV9FMA?oc=5,gnews
Bitcoin,BTC Bitcoin,2025-08-28T15:13:22Z,"Spot Ethereum ETF Inflows Flip Bitcoin Once Again, Will ETH Outperform BTC? - Mitrade",,https://news.google.com/rss/articles/CBMigwFBVV95cUxQSlpGRl9waWFZUFg0b2dhWmdYLVlFMGtQWlFPOG9EcEpibG1rVTQ3RVJIYlJsaWcxaV9yQUFmWWRVRGgyWEk4c3pqSXBweHUyem9GWjBYRl8tSDR4U1hIajFEX1ZUOEYwNmoxOGxYajJKQm9aTFVHUTdwQzU0a3ZQdV9FMA?oc=5,gnews
Pfizer,Pfizer,2025-08-28T15:13:17Z,Is Pfizer Inc. trending in predictive chart models - Weekly Earnings Recap & High Win Rate Trade Alerts - Newser,,https://news.google.com/rss/articles/CBMihAFBVV95cUxPbzdMaHFMVnpldWh0LXBpRGJaSk9VN1dvMWNVYTBPenQyQW9aZUZqUkVtenJnQlZBa0tob3pKejh2YXBQOWVIVXVZQkJidlFoU0tESmlyQXFuY0RINk5odjc4MUFEQk9Mb1lHNDI4c2V1cjZzeURhVDZ0N3pTckdIX2ZweTc?oc=5,gnews
Solana,Solana,2025-08-28T15:12:59Z,Wolf Token ($WOLF) lists on BitMart and CoinMarketCap amid Byrrgis’ Solana DeFi push - CryptoSlate,,https://news.google.com/rss/articles/CBMiqAFBVV95cUxPdEhaTXJKRFVYcmpWMHVwT201eTJ0NjZmNl9ReGl3a1RnSkRrY0NiSzFRRTRkQkpBS0t0ejh2N3R3bnR2d3pvUm91eEZoanhXeHBEOER4UUt0Y04yem1PajdERWpIMER0amFqY3lQRzRRSm5YcC01TFFNTGgyNkdCX3piN3dzalZ6NEFTUE9Hb1RkZEdWMjgyYXhoZ01SM3hUTGRlQ2RybUg?oc=5,gnews
BP,BP,2025-08-28T15:12:12Z,What MACD signals say about BP p.l.c. Depositary Receipt - July 2025 Trends & Safe Investment Capital Preservation Plans - Newser,,https://news.google.com/rss/articles/CBMijAFBVV95cUxOaU1iTE9SS1Jzck9icDdGZTBsQ2VsOFlRZ1VFbzVhNkpaRGVHNU02bVUxVHIwWVdSRlBlWXBCWTJ3Y1RVY1IwLWtKSE1aN0FUSnNZeGQ0SVRIM3NHRVlaYlBUeU9lRDBFM2pHNG5LUUI2MHRISGlESjFKQUpFYlI0LTJvbHJyU0NsWFVhTg?oc=5,gnews
CrowdStrike,CrowdStrike,2025-08-28T15:12:00Z,"Nvidia, Snowflake, Pure Storage, CrowdStrike, Hormel, Cooper, HP, and More Movers - Barron's",,https://news.google.com/rss/articles/CBMiZEFVX3lxTE9vX1dyMkdzbzQxTGNyUUxXNUpiZWpkU29NOXdUUDZmOVE4U3NpUlE1RWoxLWNqQ2JvT0hOb1UwNUQ2QzB0bmlyVTFVREFFOTF5LXNlQTlrYnZKdE9XQ2c1Sm5URDU?oc=5,gnews
Rocket Lab,Rocket Lab,2025-08-28T15:10:20Z,What momentum shifts mean for Rocket Lab USA Inc. - 2025 Market Sentiment & AI Optimized Trade Strategies - Newser,,https://news.google.com/rss/articles/CBMiiwFBVV95cUxOb3lhX3JXUFlqN0hUa1ZjdHRGVFJXYWhHUnlnTllkX2ZObnVUdWREQlEybXVmc0o3d0JwYndpaW94T2xLTjdEemVUc2pfMGJnU0pESDhJYjA2TThsaW1TVEVHNFBzU3BtS1dDNVp2WWxwajZsM2N3NG9DMmw5djZXOUREbVR1OUpSckxN?oc=5,gnews
Ethereum,ETH Ethereum,2025-08-28T15:06:29Z,Goldman Sachs’ Surging Ethereum ETF Holdings Signal Institutional Confidence in Crypto - AInvest,,https://news.google.com/rss/articles/CBMiuAFBVV95cUxNWEJwWS1OV01od3J4WlNydWdJVXk4TEhyazBZQm5LOG5fMmx6RU52aDhzd1NESDVjN2NhcjFrLUh5b2FKV0ZKc29LZjdITXpzTzNTYWp2aURxMk1Jblk1aExpcy1tRjVQQ2FjR0NWbU5PMG9mci1ncU9pNTI1S0JUbmFCcHVzVk81bzdxbWM3eUszaWxaZEpyMUpoNGxDUG9VTjZ5MDdlR2c5bEk4WE9XVzF3Skg0YmpD?oc=5,gnews
XRP,XRP,2025-08-28T15:05:46Z,"Geopolitical Risk Mitigation and the Crypto Catalyst: How Peace Talks Drive Institutional Adoption and Regulatory Clarity for Bitcoin, XRP, and ETH - AInvest",,https://news.google.com/rss/articles/CBMi6wFBVV95cUxOdV8xVnlwNXMxOENlY3RtU242X0JtYVpycG5VZ3Z4ZzdWV1ZZSU4wZUV1RnZkeDZtbzBWSEQwSzBLR2tYSVd3YjR6WnYwYjNXNFZxQklIa2RhUE4yOFY3VXdzbGR5N0tBWUtDRE1aOUEtLWFtTUFQQks4azl4cnRFVDJJM2tFNUR0ZHFKcnRGYmxEZW1yTlR4MkUtOGZXZjdBaFBwQ19zUHQ2T3R5NEp4NngtRXdXdlFhWS1uNkdSY2w4Y3NPSjhSa19FUXFYVVA4alRob2R5Skppek0zNnBCM0M4bmVTaUhMYUE0?oc=5,gnews
Solana,GlobalFeed,2025-08-28T15:05:10Z,Shitstorm nach Juryurteil: Rassistische Kommentare gegen ukrainische Weinprinzessin,Roksolana Hlynchak aus der Ukraine ist die neue Thüringer Weinprinzessin. Im Internet sorgt das für Entrüstung – und für rassistische wie frauenfeindliche Kommentare. Davon will sich die junge Frau nicht unterkriegen lassen.,https://www.faz.net/aktuell/gesellschaft/menschen/thueringer-weinprinzessin-roksolana-hlynchak-wird-rassistisch-angefeindet-110658890.html,rss:faz.net
Robinhood,HOOD,2025-08-28T15:03:48Z,Short interest data insights for Themes Etf Trust Leverage Shares 2x Long HOOD Daily Etf - Weekly Gains Report & Reliable Intraday Trade Plans - Newser,,https://news.google.com/rss/articles/CBMivgFBVV95cUxQQ1dVWUxScFF4MVdJZlh4SWktZEtZOGlwbVJFNE12dnV5QkFnRUFnZHlSQ1NPX08yMVZOVVFYaVJNMGpCbUJvRHBfV3VYbmdGWVh5bU5rS1Y5SDdQRUxNN21zWk44Z0dWSUhqeXdOUm1QQldRN2ZTWnNjTHFsWjU1am9DN1V3eTlYV1BXZl9KdjUyeGFaYnNTZjloYTBQQThHYnNhZ2lTbFVETjktXzhtWnNvODhudFRuMHpLN0lR?oc=5,gnews
XRP,XRP,2025-08-28T15:02:38Z,XRP Shows Signs of Life with XRP Ledger Set for Historic Leap Once Decentralized Media Goes Live - CryptoRank,,https://news.google.com/rss/articles/CBMizwFBVV95cUxNOWk3TS02aHo1ZXV1enJzbXZOanIyanphak9kQXdaQlBpSEo1Sms5UUNFVnJqUnBxNTZDSE9MOW51LXhac2g1Zjd3RVdyUmF1MzA3V1NPcWFhY0YxVFgwMGpaclMtYW9NT1FpLWgtSDc5cXBETnI0czJkMFA4NC1pZ25Tc3AyWGNtRFRLbG9kZWFBZlNMQ29mQ2RWaV9LNEpQV1pFbjFCbVpVbHJvVWRTY2RHTWxOeHlmWVlQVHNsTXFSald2Sk02TGY2UXRpZ1U?oc=5,gnews
Pfizer,Pfizer,2025-08-28T15:02:30Z,How to read the order book for Pfizer Inc. - Quarterly Trade Report & High Conviction Investment Ideas - Newser,,https://news.google.com/rss/articles/CBMiekFVX3lxTE1CNW04ODBBODZQNDVfUEtMVWE2aU5PQ29HLV9iYnd0OFRCd2NHN3dVSnR1eUl2YTNWbVo5ZnVMZGs3OC0xSEUyVFozNWxOdnB1NW1NZFRXalpDT2RLeDRjZENXWFAySnVwMllxc2V0WGVaLWlUX3hEYlFB?oc=5,gnews
XRP,XRP,2025-08-28T15:00:29Z,"XRP Price Prediction: XRP Holds Above $2.94 Support—Analyst Warns It Could Hit, Miss, or Overshoot Key Targets - Brave New Coin",,https://news.google.com/rss/articles/CBMi1wFBVV95cUxPSFF4UlE0dS1VTkxBclNZUXQxTVRZZmFfbGdDYm5OS0M1b3RsV3dqcHpYSWpMSG83QjJJRHk0MHZtaktXeFhCQmM3a2IyVGQ3Z1IxeFRMVkpLNjJYMHc5YjZxd1NrTXJjSXFJMWlqUDMxbGdrOTZqSmNDQ1g0OW5LakhIc0RsT19CRTZJZG92Uldod0N2RzZ3RVVsX3FzMjgxM1FyenpaV1p2SWhIM0NGNUdEZS1uLVFQeEpSUjI5SjhOemNuSWVsSkR0dGo3UVFZMmQ2bFZKWQ?oc=5,gnews
Pfizer,PFE,2025-08-28T15:00:17Z,Can Pfizer's Cost Cuts and New Drugs Offset Upcoming Headwinds? - The Globe and Mail,,https://news.google.com/rss/articles/CBMi3wFBVV95cUxQUHJSQ2hfY0ZDUDRVRE5LMVIzeExVblVmMTF1eTBrcHRkYlFOQXh4cWJoS3ZBVzRQeWlIZy1RXzF2NVFtNlVfX2trMkhmd3owOGdNanVtNjd0cW04M25COXRYRzlxMDFETUVnaU1yVUtYcm1OLU1KZVVyb3huZUMyM2VsUUlSNkg3OVFCeGtHYVMtTEsxR3VBakl4R2ZfZE4yaUVfRzQ5OTlyVHhKdXFPN1djdlA4d2NPcnZVcElFbWZFUDJ4eVR0MVJFTDdPSWdkdk5nRGpTczdIRTdtQ204?oc=5,gnews
XRP,XRP,2025-08-28T15:00:00Z,7 Reasons Ozak AI Could Outperform Solana and XRP in 2026 After Raising $2.4M at Presale - Crypto Economy,,https://news.google.com/rss/articles/CBMitgFBVV95cUxQLVlMNG9Ubmc5WjZTdDZ3UThJeVpIcFRBa0pnNTJRMHByX29hZW9JNF9UZGVNNTJ3QmlQLW54SDUwNF9PT0t4NWJIbGoxRkVPZ3NVQklTMHJmaGJsNEswckFtMlZGaHlpdmlER0NJblR0aldPYjZSdzdfYWlVOWdpc2J3cGxyNHJmTDg1djRjS1YtYVQyVmNnRjFXLUlkNEZmVHgxOVdXX2xvMTZvZ2NxMTZvVFhXUQ?oc=5,gnews
Solana,Solana,2025-08-28T15:00:00Z,7 Reasons Ozak AI Could Outperform Solana and XRP in 2026 After Raising $2.4M at Presale - Crypto Economy,,https://news.google.com/rss/articles/CBMitgFBVV95cUxQLVlMNG9Ubmc5WjZTdDZ3UThJeVpIcFRBa0pnNTJRMHByX29hZW9JNF9UZGVNNTJ3QmlQLW54SDUwNF9PT0t4NWJIbGoxRkVPZ3NVQklTMHJmaGJsNEswckFtMlZGaHlpdmlER0NJblR0aldPYjZSdzdfYWlVOWdpc2J3cGxyNHJmTDg1djRjS1YtYVQyVmNnRjFXLUlkNEZmVHgxOVdXX2xvMTZvZ2NxMTZvVFhXUQ?oc=5,gnews
BP,BP,2025-08-28T14:59:41Z,What’s the recovery path for long term holders of BP P.L.C. ADRhedged - Market Sentiment Summary & Stepwise Entry/Exit Trade Alerts - Newser,,https://news.google.com/rss/articles/CBMiqAFBVV95cUxQamlGRG5sU01vMFJJNjAyS1hFVGxQQVFpY2NaVml0TUJ5TjVvZGUtTnBpY0ZrZExXOGt2N1liMjV3SHNzZlpzLXFHVlBkZUxiQm9QZzgtZzR6X25tNzRtVTBuT0VLdnM5M0VOQTJGLWVidDV0cmhZS2hDOTY4VzBCdERmLUxlOHNBSDA3bTJKTXB6U185MkUxRUZpUnRFNDdidGhhbXlEMXA?oc=5,gnews
CrowdStrike,CRWD,2025-08-28T14:59:16Z,What MACD signals say about CRWD - Earnings Risk Summary & Free High Return Stock Watch Alerts - Newser,,https://news.google.com/rss/articles/CBMicEFVX3lxTE80N3NyeFVkeE1qRkFPNU9EVUdRaXp4dUZiclI1V2NjZE1IX0h6dmtXTU9nLWFGRk5DLTlfd0p5SXFOLW8wS2d2UDhLNkNsWFJYbDlPVUNrZmxtck5OUk9pYTBNNVFXbnRBNkdxT1JReGU?oc=5,gnews
Coinbase,COIN,2025-08-28T14:57:58Z,COIN stock volume spike explained - CPI Data & AI Based Buy/Sell Signal Reports - Newser,,https://news.google.com/rss/articles/CBMibkFVX3lxTE5Lb1ZmVEtFRDEzbm5raGxBRTRIaldhbXludGxiN3FNZHpzVEczcG5kSHk0amhqZGJpMWx3VzdmZWhBaGppelFQbUtTdTVPSWV3Mk5yZEVya0JOUGlqbXRXTWs5Tl9SN0N6Yk12RFB3?oc=5,gnews
Alphabet,Alphabet Inc,2025-08-28T14:57:51Z,Will Alphabet Inc. price bounce be sustainable - Weekly Profit Analysis & Fast Entry and Exit Trade Plans - Newser,,https://news.google.com/rss/articles/CBMigwFBVV95cUxNRzdCUzRHUERXNDNJYXpQV0pmb0NXc1JYdWZ4TmFzaHduSGJRenFPNDlVT3Z6U0ctU0JPUENVU1BnZVV4aHhURzJ4Y3FyMXE2R00wanFQalU5TUt2R2NLZjZZRmFMaS1QMGZDVG9jV1dGVGxxLUc4NWtqY3kxeVp1VF95MA?oc=5,gnews
Sprott Physical Silver Trust,PSLV,2025-08-28T14:55:44Z,Using flow based indicators on PSLV - Weekly Trade Review & High Win Rate Trade Alerts - Newser,,https://news.google.com/rss/articles/CBMicEFVX3lxTFBrUzhETkRQTjB1U2tlWnJEdnB1OGdYc21kUmI0R1hSY1p6LVg2b1E5V1dEUWN4OVROVkx3TkF2ZGdQZ1NNeVFvX1NyNUxCVmw0cnBEUGRYZThCVWhIUjVfbmlGcVFmNFdSa212Q3dEcDQ?oc=5,gnews
CrowdStrike,CRWD,2025-08-28T14:54:25Z,CRWD Stock: Can CrowdStrike Reinvent Cybersecurity? - CMC Markets,,https://news.google.com/rss/articles/CBMikAFBVV95cUxOd1dhdXdNVkQtcHVIYV81SmZLLWhwZ295d1JGSFhPRGZOc1RaOTUyTUxZOXhHeEpPVmM2NFFXTWtqcFhnNGJESmpXcU9lWm44aXlmLW90NHlVQ1FrQjJFdGc0QWI1TDhpUHl6UWNseGdpRWZRdkRoclJfRndNcENES0VkWTYwNnQ4dGVfa1VaaEg?oc=5,gnews
NVIDIA,NVIDIA,2025-08-28T14:54:00Z,Stock Market Today: Dow Decline; Nvidia Stock Price Falls After Earnings Report — Live Updates - The Wall Street Journal,,https://news.google.com/rss/articles/CBMijANBVV95cUxNNi0zclh6MWpWV2FBb09NSTRNSV94Ym1lQ05pUjNaUmNJdnR5RndWQkoxTEpRazUzeDVOeGdPQ1RLeHlHNnoyTHBPc3dVRFgxUm1keVhtOWdxbVRRcldZUkhLTmlwSjRtdFlIeGtWREpRNjJaSGhqNkp5SVF1Y0NJQ2s4dk5BSkV2bG42N25XRlFPMG5TVTZfTTdRcHJuT0Q4SWNUaXE1RUJXWUw0dGhXZUtVMVFiSHdNajU2VzZzSUpiaUNNTFJQSTlXTzR0OEl3OTA4RnBQTmtXaUg1cDJYQVh4M3N6ZzF6d1d5MVZPZ1VRNFhoMGw0VjNWMU1rQlQweUF3WldhNkhFX1ZJOWhCSS1SNWkwSmQ1U2lqbXNXazhCUWtFX0FZQXYwVms0MDZtLXNBSXE3QjBrWElFanRmMzJSOEZ5b2NCTFVlSHNhUnFYTmczY1BOdFB5NTU4UFZUYW04OXlGZ241Z3NJZ2IxNXF3UmpnU1ZMOW9NU0pON3dYMmtfV0kwQ0h1cUo?oc=5,gnews
CrowdStrike,CrowdStrike,2025-08-28T14:53:58Z,CrowdStrike Earnings: A Diverse Portfolio of Security Products Continues to Power Growth - Morningstar,,https://news.google.com/rss/articles/CBMitAFBVV95cUxNLThtSThRZThvQnpGVTY4WFJ2X1FuOVl2bTcxb1BhMmZnLVFpRExMUGNJbVN1dDUzdnlVdTdrUHpwVDdhVzh4RGpfU0M1c1pudnNhcldNeGNGTzMtVjRWTGZSX3hua29VaU56RkduTGRDWFZob0N3YnBlMXc2NUMzR3U0MEtldHV0NUxNS0RWLTFTU0Y0ZEtKVDQ2RmtIU050QXh5dmNtV2N6N18zT0dGNzEwVEo?oc=5,gnews
XRP,XRP,2025-08-28T14:51:51Z,"Cold Wallet, XRP, Ethena & Chainlink: Unlocking Undervalued Assets in a Post-Presale Era - AInvest",,https://news.google.com/rss/articles/CBMiswFBVV95cUxQTE9WbkVRTzhyU183WDJzUDZsOVFDLTZyY0stUUoySUdzWjI4R1ZuLURBNU95ckx2cTB3OUpsVUFkRkpCamV2Ul96YnYtMkg2dVpNNFhtMFN3em5qSHdERjc0SDh6c3hUZ2c1V2xPU3N5dkE0UktFZXNrSVZSTFlfV29iRmVmX1FXeWk5a2ZHV0Y4VG5DVW03OXF6R0dEaEgtcEhOXzlDY1hmWU5TVFdlM29QWQ?oc=5,gnews
Novo Nordisk,Novo Nordisk,2025-08-28T14:51:00Z,FDA Approves First-Ever Generic Weight-Loss Drug In A Blow To Novo Nordisk - Investor's Business Daily,,https://news.google.com/rss/articles/CBMikAFBVV95cUxQZmhVMzl3djd2YkpDSGJoWEpYVzllb0w3SkU5RmN3R3JILTE5WmRkN0xyU3NOa0hTYUt6MHRLdG5nZm51ZVRNMXN4UmZHeUx2MjcwbTB0TjNDeXpZdjMwZ3hVeURpMGhnb1hlR2ZvSFdVc1oxTUlYUFVhMGtKTEtkRWYtNUowbmMtMzNzOUpKUHo?oc=5,gnews
Alphabet,GOOGL,2025-08-28T14:50:56Z,What’s next for GOOGL stock price - July 2025 Sector Moves & Fast Exit Strategy with Risk Control - Newser,,https://news.google.com/rss/articles/CBMie0FVX3lxTFBNa0xQR0NiVjh3LW9yZWJsbm9FXzE1d2wtS1NnRlloSk9rR3ktTXV1NnBQTnJualJPX2ZqajV5ZVIxUDZvRXhHd3NqeEV6Sk9SM3Fzb0M2R0Q1OXhEazhpZ0ZkWDVwbi1GMDl5VllTZkEtM2d0cWVTVmQxVQ?oc=5,gnews
Ethereum,ETH Ethereum,2025-08-28T14:50:47Z,The Strategic Ethereum Exposure of Sharplink Gaming: A New Era in Blockchain Gaming and Investor Sentiment - AInvest,,https://news.google.com/rss/articles/CBMivAFBVV95cUxOV24xSk9VVkV2M21DS3g2U3I1QkwwTkp6Ulo0Y0d4ZTQ4OGF5LWNBc25NOFNQOWF0SGU1Ukp5WmJrRXdvRkJKbzU3bHQzaTlnUGZGeG1uSTgwNkRMY1N4a2R5eHZMeHgwOURHbXMzNkJsTzBuQ2kyM0JtVzVxSllCalZvZUtBODJyVXdBTE5vZjV3MEVpZzh5c0JRdFpkOGlybENjNW5zRVA5NHRFSTFLLWlCUnI1OHh3Q2VCMw?oc=5,gnews
Sprott Physical Silver Trust,Sprott Physical Silver Trust,2025-08-28T14:50:40Z,Is Sprott Physical Silver Trust building a consolidation base - Weekly Market Summary & Safe Capital Allocation Plans - Newser,,https://news.google.com/rss/articles/CBMilgFBVV95cUxObkRhcjFtRUZYTVQ2NDk3aHYwcndzWkNoSWhrVHpWc1RITmhhdVNHYXdzdjNXbHl6cXpEbjBlNUpTczFoNDJsQ0Q1cFI0enBlM0poa2xfWmNVazJIclRBS0d0cnN6VnZvNWsxcDJMdUNuWjItM0Iwd1NqR3RQeG9zX1pZcG1HSVZMREFvVWVWLXpkQjZMalE?oc=5,gnews
