asset,query,published_at_utc,title,summary,url,source
Solana,Solana,2025-08-31T14:16:17Z,Cardano No Match For Solana Say Analysts But This New Ethereum Token May Give SOL A Run For Its Money - Crypto Economy,,https://news.google.com/rss/articles/CBMiyAFBVV95cUxORGNORUtXWWpOWTF0ck8tclFNSFVpSGg2RG9QeXVmVGJZUEJobUVRZXR0Yk41WjcyQWNVQ2xsdVNFUFFlSEFtNnNfX2JpNHVxUDBWWTZITDh0akNWdkNjc3lJUm1aZ1dNRW5JaXNsODZVQlp3NVhUVnJxYmZITThxaWhfLUtON0xJRTAwMDRoNVdvUU1pQWI3RnFGX1hPaml2aXJISlRDbGhjOUhxZ2xReTduTzVDRU0tOVFFR0J2QldMUEYyNnd1eg?oc=5,gnews
Solana,Solana,2025-08-31T14:06:15Z,"Solana, Cardano and Ethereum All Launched With Presales — Which New One Is Next? - Crypto Economy",,https://news.google.com/rss/articles/CBMipwFBVV95cUxOY1Z4ZVlkXzRfcktCUHJBYTM1eXREMmh4Y1F4UGFqMjllSUF2d1ZjNml4V3UybV8zS3VfaUJ2eFN3Z0Q2Ty1hMjJrSUxQemdybkRLUHRrUGxJWDVNeUFfRDJwMXJDX3ozTGRkdG5uZVpGMmZxX1RUR3dJTEdzd1M2VjFDRDhsVWgtNG1PTmtkODBrdzAxd25mbktkMjl1NWVNOFU4SzZMZw?oc=5,gnews
BASF,GlobalFeed,2025-08-31T14:06:06Z,Liveblog Bundespolitik: SPD offen für Überlegungen zu Wehrpflicht für Frauen,Bas plant 2026 abermals keine Erhöhung beim Bürgergeld +++ Ramelow: Äußerungen zu Deutschlandflagge und Hymne wurden missverstanden +++ CDU-Generalsekretär will Beamtentum auf Polizei und Zoll beschränken +++ Alle Entwicklungen im Liveblog,https://www.faz.net/aktuell/politik/bundestagswahl/liveblog-bundespolitik-spd-offen-fuer-ueberlegungen-zu-wehrpflicht-fuer-frauen-110093143.html,rss:faz.net
Solana,Solana,2025-08-31T14:01:16Z,"Solana, Cardano Or Remittix? Analysts Predicted A 75x Gain For These By This Time Next Year - Crypto Economy",,https://news.google.com/rss/articles/CBMiuAFBVV95cUxPbEZjemg1ci1pVXNGSG5CVGdCc1BtbmVfa2drWXVZWFRIcUVfVE00S3E2cmVfS3czanNCU3VHWGcyNmh4QkMwckpZelk3dXBzWHo4bUxaQlhabElSOGU2LXA2RUo4RVF0ZkhsbXh1V2tUQUxQRlhKTzQwODgydV9iaVNINW9qS3BIdmkza0RXUWxKSnFyMEMzbzdrUF9FMC1lU0tUUGlWSTRlYkFUaktqMmZielE4ZXdn?oc=5,gnews
XRP,XRP,2025-08-31T13:55:12Z,The Strategic Crossover of XRP into Traditional Finance via SPACs - AInvest,,https://news.google.com/rss/articles/CBMijAFBVV95cUxPdzJ4U0VzVlF6bDNjazZnOVdhZFA2S3NOeXljZF9QMTZSdzc4Y3AyOVU4MWh0Y053YW1rYzk0LW16al9XelVFRnk0REdOc25QRWJxTWVnVi1UVjFLTkNMQmdEYTdJV0FPSWdRVlExWGdDdzMxb2s3M1ZmLTdpYWRZLWUzc1lDZW9nOHY1NA?oc=5,gnews
Solana,Solana,2025-08-31T13:51:13Z,Solana News Today: Ozak AI: How AI Is Redefining Crypto’s High-Growth Equation - AInvest,,https://news.google.com/rss/articles/CBMipAFBVV95cUxPNjdRcjJEbno2VndHSTg3YXlxQnUxanZ0RVdjbjFkLUhNRUNWaWsyR1hJd2pMR1FMN1BZOUZyb0I2RE9rWUtlOXN2S2I2QnE1M29kSXMzeTduaGZ5clREVGYwUzBJSDZNaVVzVElybHJvTUNtX0xvT0RxV1NTUENDdW5uc0dLYjZ5Zk8ybG9pcGFHbmtraFNVNGNfSk9mQ01xQXBRVw?oc=5,gnews
XRP,XRP,2025-08-31T13:45:18Z,XRP's Declining Adoption Metrics and Price Weakness: A Bearish Correction or Buying Opportunity? - AInvest,,https://news.google.com/rss/articles/CBMiugFBVV95cUxPZHNnc05vaDFOOUJNZm9LRS1IOTZoQ0d4blppME5TY0ZRNTlla3Fqb2stbDNSbVVCSThmcE5mYWpvWjA0RmhsU3N0UEE4Q0hldWYtalMwTjZCZlZjV2VZNlM4TVJVdkhtNkhIczNkUmt2ck1EbVp6NThYX1JUWmtYZjhmZk14ejBDNE5Nd2JUcHZEUHNjdzR4YWRmTWFCWkxITVFhSEwwQkZ5WU91RDRWakRMczgwU1QxQmc?oc=5,gnews
