asset,query,published_at_utc,title,summary,url,source
XRP,XRP,2025-09-09T13:30:38Z,"Top 5 Cryptos to Buy in 2025: Based Eggman $GGs, Ethereum, Cardano, Chainlink and XRP - CoinCentral",,https://news.google.com/rss/articles/CBMiqAFBVV95cUxOQ1NpaUJNQ0loQV9UaTdqRUFhVUMxeVNQRDNRekpXYzdLR3VIWE0wTXVlNnF0aFRkd04tQzJaNDRTaWJBSlJZUEhYbFZCMldQbGpOQ01OVzBzcWRsWFVyWDB2STdfWHNzbElaR0E4cVZMczRKdDFNWHUyeUxfWXByUGwzeGZyQW1va0NLUWhiR1Y0YVd0VlZaai12aDJHVENQczdXMnZGOC0?oc=5,gnews
XRP,XRP,2025-09-09T13:30:16Z,Surging market trading volume and ETF expectations propel XRP to new highs. Find Mining launches XRP-based mining contracts. - CoinCentral,,https://news.google.com/rss/articles/CBMi4AFBVV95cUxOR29BN1RDdEV4cmpDeDBjU1d3c0FrbDdhUEMzUDFENFBHM1pQVF9hX1lqaHVjTG94eEpMdEFfYWhxNzhFREhPV2R0TTQwNFlqSXEzb3JyRkVBUDRtdk9BTE5GaG5yREJITVMyazRLRjVuQXBMV0d2SWZWWnI2cVdHQ3kzMFRLVzRYMFdiRUIySGlRSWhYdkNDZEh6cURuTG1oNE83SEFqaXdTaDRVYkplX3ZnZzRrY3N6TUFpR2pReHNzZC1TQWNIZkF0VkI4LTduWFdUcG1SY0VHNUFxTVhzMA?oc=5,gnews
UnitedHealth,UNH,2025-09-09T13:26:00Z,UnitedHealth Stock: Why UNH Is Up So Much Today - Barron's,,https://news.google.com/rss/articles/CBMimgFBVV95cUxPV3dkZWNRSmd1Y0c1OWttZnhqeXEzeS10X1R1VFJGeWZ0NkZKZE1jaGFHNGh4aEFzZnVrZDd2azU5dkRhMk5ycldBajEtS2lRSTVlckRmbzRNWGR5SFczU0RjbnNVX0ZGTU96b3FEMmdQZ0JkQ01uQnM0SmtteG11WU51NTRKd0NlLTZ3Y2NZWmNnNVJpX3I1U3VR?oc=5,gnews
UnitedHealth,UnitedHealth Group,2025-09-09T13:26:00Z,UnitedHealth Stock: Why UNH Is Up So Much Today - Barron's,,https://news.google.com/rss/articles/CBMiggFBVV95cUxNcXlicnBBMG81YjZubTBJd0tyY2NTZ2NiMS14ZHBDQTRTaU85bUh1YmY0SmNlRk5LNU5jVWdJODd3NWl4N3RiWnVYdUJSbnFFSVBCT1l1R3BrRlBjSU9HaXU1b3l3NDhyYmNoNWk0V2JfdFlsTEprMDB0WVBpQU9CQnln?oc=5,gnews
Coinbase,Coinbase,2025-09-09T13:25:46Z,Coinbase acquires Sensible leadership team to strengthen onchain finance - Crypto Briefing,,https://news.google.com/rss/articles/CBMickFVX3lxTFB4Q1BzcWU5NzFUa1N1b1FkdUJmZmlielM5U1ZLLTBNSExybXphUExlamtLNTJ5eUFDM0phenBsUTBKcVNXWWxaUGUxaEFFZVI3NWR6Tm9YMng4OTU0LXNCeUprLWJKVnFCWkdqS0hfdjJQdw?oc=5,gnews
Rheinmetall,GlobalFeed,2025-09-09T13:25:20Z,"Rüstungsindustrie : Raketen, Panzer und Jets: Rheinmetall erweitert Kooperation mit US-Rüstungskonzern Lockheed Martin",Auf der Rüstungsmesse DSEI in London präsentieren die Rüstungsunternehmen einen neuartigen Raketenpanzer. Rheinmetall kündigt zudem die Lieferung von Flugabwehrsystemen an die Ukraine an.,https://www.handelsblatt.com/unternehmen/industrie/ruestung-rheinmetall-baut-zusammenarbeit-mit-us-konzern-lockheed-martin-aus/100154012.html,rss:handelsblatt.com
Bitcoin,BTC Bitcoin,2025-09-09T13:17:43Z,"Michael Saylor: Bitcoin (BTC) Could Smash $150K by Christmas, Analysts Agree - Crypto Economy",,https://news.google.com/rss/articles/CBMioAFBVV95cUxOX2ZSOVRjRnV2a1piVGxGR3JnSGM4ZHNEY2wzSy1ZcmVtUjVUc3M1RHFxX3ViRFp1b0hkMWRvNTZibUIyZ1hpeE9sQ2ptR19xbWFic1NrTWtvM3lXN3k5ZkZSTVdEY2VWcXg5Qncta2xnMjJxMl93dVdBeWFVWHZ6YmxtaW9UeG1PVU00cXk4d0JHLUFYc3VwVnBfTXRTN0Vx?oc=5,gnews
Solana,Solana,2025-09-09T13:15:43Z,"Best Crypto Presales to Buy Today: BullZilla, Cardano, and Solana Redefine 2025’s Market - Live Bitcoin News",,https://news.google.com/rss/articles/CBMiuAFBVV95cUxNYnpOS3BEaElXZnlyaG1jVWJkdVNnUkg2R25uQ0pVUktfQ2RFYjRDQUNsX3J4X280TktmTGdfd1BEZWE3YWxlaFRhR3pjNFhEZXMtVkJYWUlUY0Q5dnRyZW8yVTV5eVpxcFVndkE5SF9qckN4ZU9oSjlfeWNLVGZmR3A5dndRU2FNZEx5RURwNmxoaDhabXVyTmNnLTd2Y3N6c3M5TkdoSHdUNmJKUWIya0FleHR0bld5?oc=5,gnews
NVIDIA,NVIDIA,2025-09-09T13:13:29Z,This Artificial Intelligence (AI) Stock Could Be the Nvidia of Quantum Computing - Mitrade,,https://news.google.com/rss/articles/CBMigwFBVV95cUxNQVhiQWt2bzhLUUdGV3hpdU45ODdDNFlUczFHMUdUaHpzRDdnWVRoYm9uazNjVTRJYmViQm44NXhjSU5nNVBzMGl0UWx0dTJ2SFV2dFhqYl9vVkJoTHJrTnVCX3lXS1hZamRyUFk3b0lOMTMzdjl4NFpuQWFMb1ZhaHNnTQ?oc=5,gnews
UnitedHealth,UNH,2025-09-09T13:11:32Z,"Stock Movers: Anglo American, Nebius, UNH - Bloomberg",,https://news.google.com/rss/articles/CBMimgFBVV95cUxPa3U3NTJMaEdteVBlRnZhTjl4MkJsSEdwekg4b0VRS0NjSlh1OTN6ekk1N2M5cnJhc19kT2pCdFB5X2lqV1lCd0lCYllEdFdDVG9KQWFXbzExc28wcy1DWG1JYkhRTmZNTXZIUENRR1M2V3ZkeWpEcEhKLW5mODlTTVVIN2ItYUxiRkQxUGxZQ0o0TmVUR0xkeHZR?oc=5,gnews
XRP,XRP,2025-09-09T13:11:28Z,XRP Price Today: XRP Breaks $3 Following Inverse Head and Shoulder Pattern—What's Next? - Brave New Coin,,https://news.google.com/rss/articles/CBMiuAFBVV95cUxNR284Y0JMRVhZUktRX3R3Q3VOZ3FPb2pkdVMxcXB6RjZSbkpoaXQxazZmUXY1Q1dqaFk1ZUQxRnMwUkdLdGxobF9pQzgxbVlGZllTTGNIYzhYbl83RzYtcWNpcklSSFBTQWliZ3lkYVptRmc0Ny1weUI2SksxemRZZWJ0YnhJYnBmazNmTVo1Umt1VUJJc0JwUzlybmNGX0tyVnYyTlBENXpGcDhiQmZ0UXdBX1lqRVJT?oc=5,gnews
Rheinmetall,GlobalFeed,2025-09-09T13:10:23Z,Bundeswehr: Geheimer Operationsplan Deutschland: Wie Rheinmetall für ein bisschen Komfort im Manöver sorgt,In seiner Rolle als Logistik-Drehscheibe muss Deutschland im Ernstfall für einen reibungslosen Transport von Nato-Truppen an die Ostflanke sorgen. Dabei helfen auch zivile Unternehmen.,https://www.handelsblatt.com/politik/deutschland/bundeswehr-wie-rheinmetall-fuer-ein-bisschen-komfort-im-manoever-sorgt/100153088.html,rss:handelsblatt.com
Ethereum,ETH Ethereum,2025-09-09T13:04:45Z,Ethereum (ETH) Treasury News: SBET Gains on $15M Share Buyback - CoinDesk,,https://news.google.com/rss/articles/CBMivwFBVV95cUxPMGtjM1o3X3gteVZ5dXgzdGlmenpCbE5IeW1SNVhfYUlRR01FVGxBelhjbjVnRVJaTE41aHZjQk5wTGJPSmp1TWZ3WXVubEdVaFVnS1ZYM1FTcXoxcDZpUHl0dDRpbEVIQ0Y1N3FtbFB5T0tCWDVpeUlBUlFYYTVxMlpLWW8ydkF0OXh2LVI3U3V6OW41V2U1QzF1VnNMLVdZQlU0RzZMV2JrcFdhb0YzQVNXdVFlczl3alFlTzhtUQ?oc=5,gnews
XRP,XRP,2025-09-09T13:04:00Z,Ripple XRP News Roundup: Community Buzz Spills Over To Newcomer KIKICat - Cryptopolitan,,https://news.google.com/rss/articles/CBMiowFBVV95cUxOMG5lREpUNzJNWFByNGFxb0U2UkU0VG9zcS1PV2FlVEx4R01tQUJKdWpNMWk1NGFnM3JhSkpveFBveEVBX1pKM2NSS0FpNVcyR3pMQWZEWWxHSzQ0aTJ2STRUbm9OVTVQXzNDaml6WG1nN0RaTm5oRVVGSlktUnh4TkhPZThJejJrOUNCS0RUNTVhdDhTdlV5c2V2cWJxbVRnMnN3?oc=5,gnews
UnitedHealth,UnitedHealth,2025-09-09T13:02:50Z,UnitedHealth Reaffirms 2025 EPS Guidance: Time to Buy or Wait? - Zacks Investment Research,,https://news.google.com/rss/articles/CBMiowFBVV95cUxQLVhDV3pTVlBQcTF5VFZvd0dpZXh3R3pYOFVXcXJYWkVkUXhkajZDUlpRaTgxYWs4dkFobHBtQ0didlV2QmhXVlZUTTAyOFY4akNJS3Fjb0VJZ0FtdU9sZF9GVksyMFZLN1Y4ekROTld0TWJzbjhIY2czOVlicWM0Q0Y5QnB0bk9xT0h4dGR2OHU3QXpMNE5JckJuUU9zXzhfb213?oc=5,gnews
Coinbase,COIN,2025-09-09T13:01:59Z,Dogecoin and Shiba Inu Crypto Holders Buy Based Eggman Presale - Bitcoin.com News,,https://news.google.com/rss/articles/CBMikgFBVV95cUxPZ1lRRmhhcVUxMTFrd1VLZTJuelZzM3BSOTAzdlkzak1QLWlLZTl2cDVNZEFPS3hHNWU5dF9HUmdTZ0cxYmtsdFkxRi0zN2RvLWt4Yzh4OHQ4RGI0Z3pIOGZfYkpHZzFQMnROZ05lUHQ4RWI1VE4yYkp2Q3NwZXp1bWwxdEtycDBFdmtZZFc0d1RrUQ?oc=5,gnews
NVIDIA,NVDA,2025-09-09T13:00:00Z,Nvidia: Recently Dethroned AI King Of A Past Era - But Buy Case Still Compelling (NVDA) - Seeking Alpha,,https://news.google.com/rss/articles/CBMiugFBVV95cUxOSUtHR3Q4QjF6YlFBR19rMldDSlQ3dHVydHlOaS1NVEJncUtGM0tpQm15TXNPRnpXcUpqeXdNMjN2cnFQNzNkZFA0YW5wWnNsU2NZckk1M2w3Z1p4anpWVmg4U3R0X0JzUGN4a0stWUpDOV9xVC1kTGRINE5MUlg5d2QzSUlTby1tZ3BYS05UeUJqV1YyMF96T25aazFkal9HSDhkbW54a2M3OGFJbERDeUk1bmd6TGpKbHc?oc=5,gnews
NVIDIA,NVIDIA,2025-09-09T13:00:00Z,First-Ever Digital Twin for NVIDIA DGX SuperPOD: Cadence Powers Next-Gen AI Factory Planning - Stock Titan,,https://news.google.com/rss/articles/CBMivwFBVV95cUxORUpRVEZ3Y0EwUnRBazhtdmhvN3QtZXFrSzZCa2dIZTlocVNOem9wNU9TYlgwZ21zX0Q0OGNKdUs2YUo1b0hpenBqMmdLcm9pcHRKS1NlMzJjYV94c1NmT1J1Vkxla3djSWdULVpyY3JrdHlNRDhISDZTTXMyS21IWXAwYkVkeDJRREtCTHMwcVRfbkNEZ1ZzNjdCM3JVWlRLelYxUlNmM1E2Z3c1THBaMEFFRWN2WkljdE1iNkxpWQ?oc=5,gnews
