asset,query,published_at_utc,title,summary,url,source
Coinbase,Coinbase,2025-12-27T16:22:19Z,Coinbase confirms arrests after $20 million extortion data breach - Traders Union,,https://news.google.com/rss/articles/CBMikwFBVV95cUxNOTBoWVI3bjVfSlNCMjNfSzc4SnFGcDRCQVBBbEl2QkR5M0ZMQ3BkajBjYkJRY3hZd0k4Z3c2ZEoyS3lrMmp4dkdJQ0VBQk05UnUwelRsOFo3UjR4QlNCZUJFNFFWdjhTTWZxTlNlN0Ezbml0QVY0bVI2ZUtOYmxaZkZ6M2F2Z0ZYbEhiclkwalV4ZDg?oc=5,gnews
Ethereum,ETH Ethereum,2025-12-27T16:21:58Z,"BitMine Immersion Technologies (BMNR) Stock: Ethereum Staking Headlines, Analyst Targets, and What to Watch Before Monday’s Open - ts2.tech",,https://news.google.com/rss/articles/CBMi2wFBVV95cUxPNkNOcWtkbmZBaF9TbEo0ZGdhVG5CMk9PTDctNTZ2aElJTzUzeDRJcUhXRFJnNkVBN2thMGhhOGNlaW1ieFd5RFNBQTFMVTM4c3drRWpqMWR1QUhCZWx4MUJKXzhTNi05ZHptaF9xMnVoaFU3X0JzQ0syN3FvamtteGRaV2VFNFpRVl9MU05ONm1uNUFXVG9TeEhjenBGVldMZmljMk8xangwYUl4SXRaQzZyeU8zdGFpRTFRVkhoaUI5ZWFkWElhaUpDZ013MTlZNW5wWmhuaHJUMTg?oc=5,gnews
XRP,XRP,2025-12-27T16:15:11Z,"Galaxy CEO Novogratz Warns XRP, ADA Risk Irrelevance Without Utility - Live Bitcoin News",,https://news.google.com/rss/articles/CBMiogFBVV95cUxNTW9fYkRONVJwYXp0TkZjNUVWOVRjcjluc2gwaFJyZXdKWUJnLUV6R0h1dDJOYnJlMjcxVlFhRGpfTTVrT3dwMl9ESU5jZVVZeWRVcU05VHc4ODQ3NTBIOEEwdS1UNmY3MzJBRU40RkwteUp5TUgtOVptQzhkMzY1a0N5UVlueU1PNG5EQWZtR0VLWVRGdUI1U1FMX1NRT3V1RWc?oc=5,gnews
Ethereum,ETH Ethereum,2025-12-27T16:05:59Z,Bitcoin & Ethereum 2025 – Year in review and 2026 outlook - AMBCrypto,,https://news.google.com/rss/articles/CBMiggFBVV95cUxOM0hLSzFiMER3ZnE5YkJjLTBfRm9MV0o2cTZXV3JXYTdQV0tJeXFMNHQ2eFY5eVFwVjZtM01FQW1TU1BOZHZPRUhqUnpoZWNVV3ZPR2V2Wk00NWxYWEpmT0VrUjJuUll5OGdkSWZ6aUFuc1pscXVTZUpYY0NZZWlWSVBn0gGHAUFVX3lxTFBBRldtaGdSRGg3Y3kybGNZNTVtaFVjbVh5eEpFNVRxTUtReFdYUzJNWDVkMTBFdmNvMjEtY0luNEVteDdJVXpHTnV0N0VmWGNTOUhVUGpQOVVXa1dOc1oxSFlxdTN2dzRZd3ZkaHRfMkNqbmN3TzlQcWZIdEJId3VMVmdDSElNUQ?oc=5,gnews
NVIDIA,NVIDIA,2025-12-27T16:04:00Z,Nvidia Investors Just Got Incredible News for 2026 - The Motley Fool,,https://news.google.com/rss/articles/CBMimAFBVV95cUxPR2FsWk5hWHhLN0JUaEJncGJKN2gydUtGcXV2WEF1Qi1Ed2xIdFJvWEFqMUxpWHVSRFNLLVY4RUctTFhoZXJkWGE0R0NtRVRRMEgwVW9kdE9oYnVVLVV2c21adHFnd3BoTks5YmMwcDAydnJMNEVla1hTYjdLX1ViWDhBVmtlZ3hrcVRveHNLMDZSMjVCNnczSw?oc=5,gnews
Siemens,GlobalFeed,2025-12-27T16:01:37Z,Förderung bleibt ungenutzt: Frankfurter Fernmeldeturm bleibt geschlossen,"Die Erinnerungen an Ausflüge und Discoabende werden gehegt, doch die Hoffnung auf eine Wiedereröffnung des Europaturms in Frankfurt schwindet: Ende des Jahres verfallen Förderzusagen. Andere Städte haben sie genutzt.",https://www.faz.net/aktuell/rhein-main/frankfurt/fernsehtuerme-was-hamburg-muenchen-und-dresden-besser-machen-als-frankfurt-accg-200390548.html,rss:faz.net
Coinbase,COIN,2025-12-27T15:38:10Z,"Coinbase Stock (COIN) Update: India Arrest in Hack Probe, Wall Street Targets, and What to Watch Before Monday’s Open - ts2.tech",,https://news.google.com/rss/articles/CBMizAFBVV95cUxPM3BwUVA1X0N6cEsyNHlDdW05MGZmQlZ5ZTRwZW5DUjV1X3cyc0g3SHl6OExaa2ZFdGc3aHBQdjdhX1RHcFBMVjJuQmZDN216SWxZdXctMGQyR3drakhzbmYyaTBZT2FySjB1SmZGamZTZm5aZGdHenNsRmZEWGpRd3ZhTGpoSlg1dExmSGE2WGxqVGxsMERCVlNoaU5VZmg2RUFhSGlHTUhpQ3V3VDQ3T3Y1b29DRElfUl8wV0JmVUpRdVM5VlBqR3phOHE?oc=5,gnews
Robinhood,Robinhood Markets,2025-12-27T15:32:34Z,"If You Had Invested $1,000 in Robinhood in January of 2025, You’d Be Happy Now - AOL.com",,https://news.google.com/rss/articles/CBMifEFVX3lxTFBLLTZzTWVrVldCWEgySVZaMWxxOE9qS0ZTZ0thZ3pZM2hEaERxaUVnd0w5b2JtUFZ5ajNnYVVSbGpsSjBzc2ZPUXBOc05pQ3dHaTBsTVpmZS1iZUJNSmpKdjlGbjJJWVUyb3JaOTRfcDBCd3JSLS1jUnNHQkc?oc=5,gnews
Unilever,Unilever,2025-12-27T15:32:31Z,Hindustan Unilever Limited (HINDUNILVR) Sees Unusual Trading Volume - Market Volatility Update & Try Our Free Strategy Builder Now - bollywoodhelpline.com,,https://news.google.com/rss/articles/CBMirwFBVV95cUxNSExpWXVld1NYMHRFSzN4YXVLbmg1dWNpSUN3WldxUHdoNmRDQzhWVkRXN3dSMzhpYmxpV094bFhGNFE5Um1WRExNV2V3RWU2SmxQcXZWYnR4OXFRWGdldjBIbXpfSXd5VWQybDJhY1NpOGlfeHJsb2wwMHJEbDBlTkFpbDU5Y1VUMllzTFlNYUtHYW82QVo0TEhTZlZuNzZUV1dZM0FXb2ZDLVVqZ2lN?oc=5,gnews
Rocket Lab,RKLB,2025-12-27T15:31:40Z,"Rocket Lab Corporation Stock (NASDAQ: RKLB) Pulls Back After Holiday Rally: Space Force Contract, Analyst Targets, and What to Watch When Markets Reopen - ts2.tech",,https://news.google.com/rss/articles/CBMi-wFBVV95cUxPaU1JLXIwSjNHczVRbmZsUUhyNHRqMDZ5ZVVvdml5QnowMFR6SDFXc0IyMC01dFdaZGNwbVBiVk1SeFlpTkdTMnVTVVgwVmRlc1BXbXVoOFpMZk5FSXlqVjRxRU5qZ2lfMWpJWm8tUjlBNzVwV3RYM2pnbEZyU3BKVjIwSlpCN0hUSkZFRVRiN2txTnJBMER6dDFkUzZzbVpmOFFIc2FCSTdkMDc1Z3hBaXFqOFdqM1lzTFF6TGxxTzEyYUN5aU5sZEdSX2NYTmlCTEdZQXF5SkRpVnk3ZVdUTlMwR1BWYkdWZDIxS1ZDemFBai1RNGI0RFFaSQ?oc=5,gnews
XRP,XRP,2025-12-27T15:28:46Z,XRP Cryptocurrency Steers Toward Practical Transformation in Finance - OneSafe,,https://news.google.com/rss/articles/CBMigwFBVV95cUxQd0NPdlNZUlBsMEFDam8zZzQxUklFTzQ3SmNScTkxWHo4enF6VVlRMTNhV3hOc1hETjNwU1FaSFJ4RmUzR3FiZTdfek9YV2RKVjNWVU4yUGtYZ3BodHVvVnZEdHpCRDlnUlREUFlxM3V3WUdHakpSZXUwdENYaGNlbmRlcw?oc=5,gnews
