asset,query,published_at_utc,title,summary,url,source
Bitcoin,GlobalFeed,2025-11-03T16:49:02Z,Kryptowährung: Bitcoin  fällt auf 106.000 Dollar – Eine Korrektur droht,"Die größte Cyberdevise sinkt entgegen dem saisonalen Trend. Analysten sind besorgt, dass sich die Kursschwäche ausweitet. Eine Marke ist hier besonders wichtig.",https://www.handelsblatt.com/finanzen/maerkte/devisen-rohstoffe/kryptowaehrung-bitcoin-faellt-auf-106000-dollar-eine-korrektur-droht/100171008.html,rss:handelsblatt.com
NVIDIA,NVIDIA,2025-11-03T16:43:04Z,Nvidia Stock Scores Price-Target Hikes On Latest AI Chip Deals - MSN,,https://news.google.com/rss/articles/CBMi2gFBVV95cUxQTWowY2t2Tnc0cFp3dmp4djB3b2h2emxyLXRyWXBvOXR2c0Q0eHluM3JXSzN0OEVKUWdxbWU5aVpRUktUbVV3cm45eW5tc1lfQmhFQzJIOFR5YU52SDNsOGlLdmRzcDdOMUJGcHJCWjNCbElMcmxib0E3d0hmYUlmZURlcEFRLU4yUnN5cWU0NnJzTlBqRG5nOVFaek04QUZDMmtyQ2RWV3dwN2hNYVU0RzhZRi05ejBrT1FXbHE0SVVPSnJFY1k3MzRBVlJIbk1Ca2FfYk5qdUtZZw?oc=5,gnews
Alphabet,GOOGL,2025-11-03T16:42:41Z,Alphabet Is Still The World's Most Efficient AI Monetizer (NASDAQ:GOOG) - Seeking Alpha,,https://news.google.com/rss/articles/CBMinAFBVV95cUxOdnlreFhKZEk0bGxhNE9QX1U3STBlSldUcl9QOWRwWjV2WGI3bUwyM1YtNFJDZUNYblhuaGZNYXdyRmtvQlQyRjlnZWx6cUwyUlJxN0dlemQtTURmMUQyRDV1QnBTOVdDUHgzNHI2eHNKQXZZdjU1QWxJbzJTM1lZdS1vT2UwQVZYREtKeGNjelNPN2xPTW0tNG9zbVA?oc=5,gnews
Solana,Solana,2025-11-03T16:42:14Z,"Solana Price Prediction: Analysts See SOL As 2025’s Powerhouse, Will It Lead The Next Altcoin Season? - Crypto Economy",,https://news.google.com/rss/articles/CBMiwwFBVV95cUxPLWNmbG1FOUhoME0zV1kxeDkzTThBai1mRWxvaXpIZWtLQU1MZGthMldsUHI1WlpSRmRiUHZ4akFTdlUtRVdaTTZuNm5JTEdMc3cyVEh4Y1dOQktnMVNBbkVMcHNaaFRzMlJNRnBGaHNSaWlRTkx3NE9TY2ctZEh1c19idlA2MzZyc24xbTgyZlBMOE10c1VaQ2JFQ3RkMWpsaG5FZGs1N1B1QzU1Vl9Jc2s4MERvT1NPTHY0RWZ2VFdNOFU?oc=5,gnews
NVIDIA,NVIDIA,2025-11-03T16:37:22Z,Nvidia Sparks a Korean Stock Frenzy: $12.8 Billion Floods In After Trump's Tariff Twist - TradingView,,https://news.google.com/rss/articles/CBMi3gFBVV95cUxNVVBNY3dlUkN6QV9Ua1BkWWxCTWFmenhoM1J5NVByLUpvRmpIT3EyLVdfaktBbzJXZmlUbDV3UVZ3cmdOYWYwOFMxdVhJWTg4Z2FrYmNoc2Fxd0JiMXdkemwwWWkxRjBHZ053RFpXUTluQmI4UkZqMEkxMnQxczd2X0Q2YUZPSmUzaFQwU0lYaGRiejdPcUpVRmRjTmJOSG9mNm03bW5tTzZ2SFVpMUk0bkF6MjdrU3NvV0k0bFg3X2g5UzU0dEZxMmxzTmNITVBNUEkwT0RPdHJWZmtieXc?oc=5,gnews
