asset,query,published_at_utc,title,summary,url,source
Sprott Physical Silver Trust,Sprott Physical Silver Trust,2025-08-29T17:42:47Z,What data driven models say about Sprott Physical Silver Trust’s future - Trend Reversal & Consistent Growth Stock Picks - Newser,,https://news.google.com/rss/articles/CBMiswFBVV95cUxPR21obkJxUGVMOEtuVGpscHJKb1BLeXpUS1dvOVFuRzFQNUdlZWZGREd1dzFoWDQyQWRmOVpzWGt0a1Q4dkUzdGhMdVd3NHlNYXdXZDBtU2VTR0RGMVcxd2RzQTJkNUJudnd1ODRzaXE5djc3V2N3bXVJY0xaN21YcnJwSU9kbEVNSjJ5dU5fLTFEZjA4eHNHMUJUaXpiNjVUTnRDNkhPRXAtWk9SN3pyeDIxcw?oc=5,gnews
BYD,BYD,2025-08-29T17:37:34Z,"BYD's EV Empire Stalls: Profit Crashes, Price War Spirals, Europe Now the Last Hope - uk.finance.yahoo.com",,https://news.google.com/rss/articles/CBMigwFBVV95cUxQdFhmV1dmMlVIWFU4N0U2dzhVTkFFdS1NeGk5a2lhM1FtVEY5S0M1SWc1c2RUZ2RXVmlqNEVHN1BSdS12UEZOVVNGeEo4UDZWbVM5Ri1SbXR6cDF6VjRjNm10SUpiVjZmQjlScTVZSV9Rd1BaYUdwdkR1NmppQlFrWEFvQQ?oc=5,gnews
Alphabet,Alphabet Google,2025-08-29T17:37:28Z,What earnings revisions data tells us about Alphabet Inc. - July 2025 Macro Moves & Intraday High Probability Alerts - Newser,,https://news.google.com/rss/articles/CBMijgFBVV95cUxOTF8wZ2xDNElabnZOSTdZVjRtQm5jb25SQ0pKZE04QVlSVWtyRWttRFItYnRMbU1xM0hFaF9oSzhOZWJRa01ROHhNT3cxZHM0bUxSTW9rNE1oNzZjemtMV21pN09RZFlDOWJTZlpsQnBmWFFHbHpGa0YyMF9NSUhiRzkwS2FOTWgtWTlVQXRB?oc=5,gnews
Unilever,UL,2025-08-29T17:36:45Z,Is UL Solutions Inc. stock poised for growth - Weekly Trade Summary & Technical Pattern Based Signals - Newser,,https://news.google.com/rss/articles/CBMifEFVX3lxTE0zNmNHZjVCbHRsNVYzWHZXaENmT09LQnVHOVVvSVhOOXJtUk54eFI3YXN4azBaWHdaMEtaR3k2amhuYy0xZENkM2hHenFYbFhHWTdmdjNJTjVGTE05MnNnaXBvUE1jNVpQRFFmX2hlazJ6MHMwXzBoYnVfTU4?oc=5,gnews
Ethereum,ETH Ethereum,2025-08-29T17:35:34Z,Crypto's Volatility Revisited: What Ethereum's Dip Reveals About the Market's New Baseline - AInvest,,https://news.google.com/rss/articles/CBMioAFBVV95cUxPVnBURjRuZ3BfaEt0RllwNVkwRm1DN3BjVmdtUUZHRl9SVTNqbWNBNHhFbFV2ZWQxNHg4N3JsVzB3b0FEZ3FtdWVBNGxYdWltaEdBMmJHTzdPWkdFOWdVcHJ5ZzdmQXRkdC1fS20zOTMzRTN2cnJvNXJ0V01aYXpjdVlzVlBVdEN0Q2ZfZWRoRnBiVlFtdUl3b0dVLWpmaXJf?oc=5,gnews
Ethereum,ETH Ethereum,2025-08-29T17:34:00Z,Best Crypto to Buy Now as Ethereum (ETH) ETF Inflows Beat Bitcoin’s (BTC) - Cryptopolitan,,https://news.google.com/rss/articles/CBMioAFBVV95cUxOOEFnZS1YUURnaGVaZ3h1Rk4zSmp5cUpKbFQwZDFNZlY2Mi1VYzNEY3FIaTB6b3dkUVlFUnNDQjdoaERtZUdpY2FxVjR4a3VPUnJSSklkQ3BpQm1HSE54WTJzUmFFZFA4ZHBKZlR6TGczV2xnNkdKdzBPaXpGR2Y1MFN6b0hmYmFpUWxlRGJFbzhmdXJDdTJFOHpxNlpJejFK?oc=5,gnews
Bitcoin,BTC Bitcoin,2025-08-29T17:34:00Z,Best Crypto to Buy Now as Ethereum (ETH) ETF Inflows Beat Bitcoin’s (BTC) - Cryptopolitan,,https://news.google.com/rss/articles/CBMioAFBVV95cUxOOEFnZS1YUURnaGVaZ3h1Rk4zSmp5cUpKbFQwZDFNZlY2Mi1VYzNEY3FIaTB6b3dkUVlFUnNDQjdoaERtZUdpY2FxVjR4a3VPUnJSSklkQ3BpQm1HSE54WTJzUmFFZFA4ZHBKZlR6TGczV2xnNkdKdzBPaXpGR2Y1MFN6b0hmYmFpUWxlRGJFbzhmdXJDdTJFOHpxNlpJejFK?oc=5,gnews
Robinhood,HOOD,2025-08-29T17:33:38Z,What the charts say about Themes Etf Trust Leverage Shares 2x Long HOOD Daily Etf today - 2025 AllTime Highs & Accurate Trade Setup Notifications - Newser,,https://news.google.com/rss/articles/CBMitgFBVV95cUxNM296MmpJbURrOWE0RlFpMjJnQzc0b1FOcGxGWk5pMk5UeGFBTncxbnNjLVdWeldLek0tYkQwTW9ybnJPMXBLLTRqc0RaWHY4Ti1uZnVJdjJmdTdjZF8yc1YyVUdEWk5NWTk1ZzZBYktZaWstZVlLeDJWZWZLaWdSTHBMVFBxWlJHR0pYLVBfaWpPbnhad0lJc0ZkUFdDbGZyWGhFUWZFek1EWkt2MGNaQXBWempoUQ?oc=5,gnews
Ethereum,ETH Ethereum,2025-08-29T17:33:34Z,"Ethereum's Institutional Takeoff: Why ETF Inflows and Staking Yields Signal a $20,000 Future - AInvest",,https://news.google.com/rss/articles/CBMiswFBVV95cUxQb1o0TWk2Z21VaXZtZHVRTzlnbHpNV19UaHdyaVJwdTR0SVlTNWpOODJRXzdBNzNCa2o2U3lTRlZPa3Ftcl9QV1VjNnBGVVUyZ3NZb19tRTdxRDNfbTU3elFFVmxqa3R4NUZDck1YRlFnTnZkVDRoODdjMjM1RHpXOXBKSDRjMnhFcUFENnZkVG91bGZqOFVVbGt4MTl1bGlEdDF1ODZEVS1XQm9lbEpvVE1KOA?oc=5,gnews
Coinbase,COIN,2025-08-29T17:32:33Z,New Meme Coin With 3500% Staking APY Is Called the Next Crypto to Explode - CryptoDnes.bg,,https://news.google.com/rss/articles/CBMinwFBVV95cUxNbXZRTlh0VktmdDFNaGpYOVlJWUJ1NndZSWRObzdpVDN3Z0wyb204bWt0eV9Tb1ZySkM4QVB3WHpDbE81dGJrSXZURXppRlUtelJLWEZJWWJZT0VVSDBFak5nRE9lbjVtSnVnakEzQk9hLWNpZXlvekFOeTJUV0UweWxCLXgyWVY3ak5hdG42OVVGdmlldFp0T2xXbGpBSG8?oc=5,gnews
Robinhood,HOOD,2025-08-29T17:32:30Z,Robinhood Markets (HOOD) Up 0.6% Since Last Earnings Report: Can It Continue? - sharewise.com,,https://news.google.com/rss/articles/CBMizwFBVV95cUxNZnd4eEZJQ0dnZzJIWE9wSlJmMF8zNEFaRGZGQjRwWEdSNjZZbnB1V0VyVEV3M0RCUnlsTXdCZF9aR1ZoNUdoaFlWNTBNNU54VWdYMjB6U0V5bzk1VnpyanZLWUhNQ2pZZHB3ZW1aZkFjd0hPYVBKRzhTVlpDbGkwVF9xSXFzZW5UaVAtY3FoQ292WkVEUlFhU3ZEQUZvek9jVl9QNlJGXzhrVlc0TXIzeThEWDNvVl9td09HTG9LRHQ3MGtZRnphVW5nM0l4M00?oc=5,gnews
Sprott Physical Silver Trust,Sprott Physical Silver Trust,2025-08-29T17:32:08Z,Will earnings trigger a reversal in Sprott Physical Silver Trust - Portfolio Update Summary & Consistent Profit Trading Strategies - Newser,,https://news.google.com/rss/articles/CBMimgFBVV95cUxONWpiZDVHNE90UHdyeGhwd1ZQcU5sRkZIRFpTX1lLN3l4UFJONnBibkRmVVdoUmZ0N3dYZTRQczA0QmNKdVVnbHl2UVFRY2twRjB0am9fOGpPeTBuZEZCMDZsbE1ybi1fbzRER25KeV96QVlnaWVjRDk5d2w3ekl6YXFlb0pyenRGR2wzSTZRcjhldVROMVNkRHZ3?oc=5,gnews
Bitcoin,BTC Bitcoin,2025-08-29T17:31:00Z,Big Correction Coming for Bitcoin? Support Break Could Push BTC to $100K - FXEmpire,,https://news.google.com/rss/articles/CBMivgFBVV95cUxOV01GdS1HM2VZWURMRTQ5VXJUdWpkR09hbkxGdmc2LUhPNmhvcm9rakZlZi1oRnpVeElxd1M2UlozRFBDa1F1VTAtbmREeWdVNy1haHJKeGpsNEtSeUpSTzlTSlVJLVhBM1BsZFdNUnhpSE5DbU1MMHdudkZjdXJ1bGlSYlBsb2FlVTcxOVRzcWlXVUJOdGNXNnYtRGxseTRxbE5naTNEdURfdUVvYnNaLXVYUERYSzZTdnctT3dn?oc=5,gnews
Coinbase,COIN,2025-08-29T17:30:24Z,First Mine-to-Earn Meme Coin Hits $500K: Is Pepenode the Best Crypto Presale? - CoinCentral,,https://news.google.com/rss/articles/CBMioAFBVV95cUxPT3NDTVNTdWxVd2pIdkhOcVVkODRBREFaNFRJMDh2dTl6QnBNdkR2UldUX2dBRHY5RDJabWVUbjQ2Q1NOaUxnb0EtZndCQ1NOZXUyUVdEeWd6OGhwbUhpeUtzNFRSZmhZNHIxOHBONm9ERzRVNm5wTDJGdHlWNTNVQmZzVVFFcG03RWt0enUtbG9ubW14a0RHV3N1T2gwclFw?oc=5,gnews
XRP,XRP,2025-08-29T17:29:42Z,Gumi Doubles Down on Digital Assets with $17M XRP Treasury - parameter.io,,https://news.google.com/rss/articles/CBMihgFBVV95cUxPTzktYVBIUFljUkYwbXgyUDVMTEdOS2l5WThKaHQ2ekJfUExKNE51NkxOWTlzY3FnXzktVGFLMmVvWE1yR0ZPUWRNSU85dTU4SWNtd3dpdFh6RGN6eER5R2lmOHBwblFZNjdWODlKSnlXM3FGR2M5T051aXFOcUVTVlYzX2FIQQ?oc=5,gnews
NVIDIA,NVIDIA,2025-08-29T17:27:00Z,Stock Market Today: Dow Retreats As Nvidia Weighs Heavily; Marvell Flashes This Warning (Live Coverage) - Investor's Business Daily,,https://news.google.com/rss/articles/CBMitwFBVV95cUxNd09QNGRodXh4TFJSLTdNYmlrdExlc2xBbnh3a1ZybFdxWFJ2VUNVY3dpYmYzNm1peWJKdWpHck1GczdjcUZaUG9jSGk5Ukd4dEJUQTQza1pOcUJsalQyV3V0a09PaGdCdGVKTlpuQXVIaWl0bXRJcGQtbWMwMVR0eEo0ckxxNE5zbkl6Y2lOWWpHWmx4eXdqdDM2ejdkTzFadVo1Mm1ydmtiaUZ5RmRvZlo3SS1DZTg?oc=5,gnews
