asset,query,published_at_utc,title,summary,url,source
Alphabet,GlobalFeed,2025-11-17T03:17:43Z,Digitalgipfel: Politiker fordern Signal gegen US-Dominanz bei Cloud-Diensten,"Vor dem Digitalgipfel in Berlin fordern parteiübergreifend Politiker, dass Europa eigene Cloud-Angebote stärkt und ein klares Signal gegen die Abhängigkeit von US-Anbietern setzt.",https://www.handelsblatt.com/politik/deutschland/digitalgipfel-politiker-fordern-signal-gegen-us-dominanz-bei-cloud-diensten/100174752.html,rss:handelsblatt.com
NVIDIA,NVIDIA,2025-11-17T03:14:00Z,Nvidia Earnings in Focus as Asian Markets Cautiously Await Key Economic Data - Mitrade,,https://news.google.com/rss/articles/CBMikgFBVV95cUxPUTYtUl96aTNYWjRvLS1oWGRDOEFqSUxCb2JtS1VILXBNRkFDa05KOXY4UmRrNGsyeWREQzFzYnRUaGNNTVd4UUI1YzJSOEVCQWNVbDlCODE4U3RmZDVRc19HakFfeVFiUUJqMUFFem8wZU1aOG5BelpIZUp5dUZPV0I2eFlwc3dTdERoTmdHNWc5dw?oc=5,gnews
Alphabet,GlobalFeed,2025-11-17T03:09:35Z,HRI-Konjunkturausblick: Endlich wieder Wirtschaftswachstum in Deutschland – zumindest ein bisschen,"Die Hoffnung auf höhere Staatsausgaben verbessert die Stimmung. Harte Fakten, die einen Aufschwung ankündigen, gibt es bisher aber nicht. Das Handelsblatt Research Institute bleibt vorsichtig.",https://www.handelsblatt.com/politik/konjunktur/hri-konjunkturausblick-endlich-wieder-wachstum-zumindest-ein-bisschen/100172095.html,rss:handelsblatt.com
NVIDIA,NVIDIA,2025-11-17T02:39:50Z,"Asia stocks decline amid weak Japan GDP, Nvidia caution - Investing.com",,https://news.google.com/rss/articles/CBMisAFBVV95cUxPeFFWYV9kLWhIejBNMF84dDNsZHZsdEVxTFEyNGd1Tk1xa2dmOXkzdFdTNVpRRm1qZW9qWEtSLW1HbTd2NEhkYVh5VW9YTmZacGk4TmprUGZSTmxnaU5JNC0ydGg0eDc4S01fOXplQmphWG9USzdmaW1tOTZydktyUk9UTG9pNmZZZWtyMWRlUnJYX2ZyYVNuWlA1M09xYlVjbHFRZWozLUJabFBtMEM5cA?oc=5,gnews
Ethereum,ETH Ethereum,2025-11-17T02:38:00Z,"Ethereum Survives $3,100 Breakdown After Hayes’ $4M Sell-Off and Whale Awakening - BeInCrypto",,https://news.google.com/rss/articles/CBMia0FVX3lxTE9EakxoeE1Sc0xOTWViRV9wa00wVjhXRXk0cHhNMWlyUjRiMDQ0YmJXREhUM2VHb3lHaHY5VWRQeE56SG5QT3RJVXRjM2RweF9ZYTduSEVmS3JLMWtEV0IwRXhSNnE3bWZadjVn?oc=5,gnews
