asset,query,published_at_utc,title,summary,url,source
Ethereum,ETH Ethereum,2026-03-14T16:38:09Z,"Ethereum Price Prediction Turns Bullish After BlackRock’s ETHB Pulls $100M, but Pepeto’s Exchange Token Math Outpaces ETH Returns by Orders of Magnitude - BlockchainReporter",,https://news.google.com/rss/articles/CBMijAJBVV95cUxQNU42aEJoVV9aWmhnNHNqSEJaeEdXbUlwamVUZXUxUDR4NEVxUTFleG51UnVveWdDOGpKUUZHd2p2WTJMTEZrWHRsODZud3VFUFRzRDBzbVAwcVdqek9jNENON05Yc3B2V2hzdmhnd0NSdmI3cGQxd1R1dmNQYmVxWmdDdmxFOXZya2ZMZlNWTkllLWZfSl9xSFFpQ1dHNjI1NVhRbTNkRkxDS2hicGpULU5WWWpjY2JjNzREaXpWbko0YkRZd3hTcW9kMVdNZlNheWhHUmV5VGQyRVBHSXR1R3BrLUtUV2tVV3dVNUJqQmM2cnROZ1NCUVM4eGRyR1piNkxWUmlNb3pTUE5h?oc=5,gnews
Coinbase,Coinbase,2026-03-14T16:37:00Z,Coinbase Bybit Partnership Talks: The World's Largest US Exchange May Be About to Back Its Biggest Offshore Rival - FinTech Weekly,,https://news.google.com/rss/articles/CBMiqAFBVV95cUxQRmRWd3FreWhCMHpYX2dZV2tWTkpDeEx6N3NPS2tSSUY4VGN2OFdDb19hY2JOc0YwZTI2bE8tZmo4RXg0T1hGYzZJdy05R0VLRzk0VmY4LXhwbS1HZXZYTl9rVVE2M09YeGFPaERmVnFOTmJZVGFUZ2FIWEJlaVhhN1FXQnNPVWwyeUxFZk45cllDRDVTZ2FRN3FNUW1VMzFYX3A0WnJkckQ?oc=5,gnews
Solana,Solana,2026-03-14T16:34:55Z,Solana Price Prediction: Mastercard Integration Confirms $300 Target as Pepeto 267x Exchange Presale Nears Final Stages - FinanceFeeds,,https://news.google.com/rss/articles/CBMi2wFBVV95cUxPei1ha3FQRlFocXc0WkU1Vkp3UjFiR1EzajhocmRYOE85c3pUNVNUZlJZS0k0blFyaGItdXQ5ZUcxamktdmRaVXRUZmRKazNsckotazNhSU9iVmdUNTh0ZVVBOWdoVGxDRlN6RkE4YjVySlF6ZXFPRmNDZWtpbmJRT1N1OGdsVTN0ZVhMX202SlkyRnFnWWkwQlplZVBBY3FlVk56V0NuQmtwVjdlZUh6QkdJSWIzeUdBZ1NFTVoxTFllazBkU2tmZ1EwNjYyNTNQOXQ1eG9IdzAwRHc?oc=5,gnews
XRP,XRP,2026-03-14T16:28:36Z,XRP Price Prediction Benefits as SEC Chair Backs Streamlined - openPR.com,,https://news.google.com/rss/articles/CBMinAFBVV95cUxNX3d5TURab3ctTHZFMXJTRms4Z1BVQlhVYUZaa1ZoUjdQT3dlN3Y2UlRaWVhiM1dXSlVldXNJM1hqd1FvR24zbFBLaE5GSDI4MlpyUHFXUWdkcWQwazhzVVNTcTJTZ1dWMzNNUFZYTktNYWRBSnFSaVVoVnAzVjBCV0pXZXp0TUV2YmZBdjhhZjJtN3RGWmpWLUtGdk4?oc=5,gnews
XRP,XRP,2026-03-14T16:28:14Z,Prediction: XRP Will Be Worth Less Than $2 by 2027 - The Motley Fool,,https://news.google.com/rss/articles/CBMiiAFBVV95cUxOQW91ZEVOY3BXRnZVeTZiYlBHMlR5d0ZMVGlVR20xMTltc3NWQjNkNmdHZGR1VmUyTE9ZZ1lkVHZQZkRTUVlZbk1YOFZBcW1jNEI3STh4bjlKc2NJWHlYTTZFdEVqTTBHSU8wNVN0OVZjR1JMOExNWWZsay1uUHJrZDBQOW5rT0Z6?oc=5,gnews
XRP,XRP,2026-03-14T16:14:27Z,XRP Price Prediction Targets Recovery as Global Crypto Market Cap Drops 18% YTD and Altcoin Rotation Approaches - openPR.com,,https://news.google.com/rss/articles/CBMingFBVV95cUxNaVNLUlA2VXFRYzVpRUFYeXgzMzZ6WVBKUmhERms3VjlpWUZobW5aUkhRZF9pVEFDemFoaHNIYUtrVnI2Q2NqX1FMSUdjRGJpQWVWVnhhQmx4QTNPY2VZZTR2MDFteDMtQzR3bEhfQ2hjOHFDMF91TXNWLVdiSG5HVmNaU1R5Wnl5b3RDeWVXUnE2ZnRDVWl0U2V2WVpMZw?oc=5,gnews
XRP,XRP,2026-03-14T16:10:13Z,Best Crypto Presale Gains as Historical Data Reveals XRP Could Rally to $8.6 and Cycle Repricing Approaches - openPR.com,,https://news.google.com/rss/articles/CBMinwFBVV95cUxOYnBQeXZDZHhsd2hnejdhX2h2VjZ5YU84Q18zRl9COGMtUFZJOW1NM21UdHl5QVFTU21qemx0V3dzUWRfTVZpanA4SWZkalVGQlRGZnBjdmVlVXUzYkdVY2Zxci0wUlotYkZoaHU3Skd4MXZpNF9JVk5rSkxxSS1qWEZ0c3pjdGpRcmgwUWNvWkdLSE9sN2M2ZTR2clZHVjQ?oc=5,gnews
XRP,XRP,2026-03-14T16:07:39Z,XRP Price Prediction Improves as Bitcoin Volatility Data Confirms Crypto's Panic Phase Already Passed in February - openPR.com,,https://news.google.com/rss/articles/CBMilwFBVV95cUxQOGdVUHpRMDRBS0dFajNSdWFwZnV3UnNkRDRJUUdwQkc5dHVIV2dGTnNzSTRvS0NYZ21DMlZaY0llQTctTWtDc295Sy1Qa1hiNDRROUNYU3NYVTFQSHgyTGprcmhGcG90N1dQWXlXQUswMkpMX204bWhnQ0cwMDZYVXJ6TWhfOTlDUGFNQUJvNUpLOFZsUWZZ?oc=5,gnews
XRP,XRP,2026-03-14T16:07:21Z,XRP Keeps Stalling at $1.45: Why the XRP Price Can’t Break Past $1.76 - AOL.com,,https://news.google.com/rss/articles/CBMidkFVX3lxTFBERUhsQk5LTVVYTVBIQlgwb1B4RDI5d25WcVdZYlo1eFlKT1RJREJHWUE1ci0xUE9wUnZlQ1dhREZxVC1ZNG96ODV0NWVnaTV1dHRtRzJPVDVwQmkzcjdleWREQmJoZG8xd0lKdlU3Znk5T290LWc?oc=5,gnews
Alphabet,Alphabet Google,2026-03-14T16:06:34Z,Alphabet vs. American Express: Which Warren Buffett Stock Is a Better Buy? - The Motley Fool,,https://news.google.com/rss/articles/CBMilwFBVV95cUxOVElOWUFLTkJfLXdpeW1EUlZ4eEticzY3VHRUcE9YdnBQS0l5UHZPaXFaU1R5ZWw3anNIU1JsVHZMdW5xN0trcDFRalhQbTh4SFY5bFQ5RThPVWZhWlRyeEhCWlBVRlhINGN1Vmpsa3c1SU56S0dEX1FacGo1d0dLQVphS3RuVE91TmkyYkNDcHI4Q1lTVnRB?oc=5,gnews
Coinbase,COIN,2026-03-14T16:06:06Z,Is Dogecoin a Millionaire-Maker Cryptocurrency? - The Motley Fool,,https://news.google.com/rss/articles/CBMijgFBVV95cUxNM1JrRE04cEowQ3FRUkFndzhLd05ja3Z6M0pDVjBkdmVDYU5Ib3J2VzBrTlp5N3RNeEpvWGVnSjBDY1Q1cGFuNERwQUEtYWFEU2lzRnVVVTJ0emwweVFlVlVGclNDMTNubjlvNGY1MWVwYU43RWl2cmV1Z3BZNTNvOXlzS3BRZ1NBZFl0cjh3?oc=5,gnews
XRP,XRP,2026-03-14T16:00:49Z,XRP Keeps Stalling at $1.45: Why the XRP Price Can’t Break Past $1.76 - 24/7 Wall St.,,https://news.google.com/rss/articles/CBMirgFBVV95cUxPbmhHZFFVRkpoWFpIcjEyUzB3MG5qR2tXUThQSXJTcElmQVdlUGtNc1FqNDVvRkNnZWZUY3BlWGc4VTV5M2FDQUFpb09HNzkzYUdSU2pPejJ3OXh1b1dzQ2lVZDY1ZlNjNWxUUzdMbmNNby1QemdqeHRtX3pDLXliWXFMUE5lY2JRNTEyVm43RXB0Vzh2UWlmekIxeW1NMnhsN0FDeTlFU3R2dGpKWXc?oc=5,gnews
NVIDIA,NVIDIA,2026-03-14T15:43:03Z,"Jensen Huang Takes Nvidia's Alpamayo Self-Driving Tech For A Spin, Says It 'Drives Like A Human' - AOL.com",,https://news.google.com/rss/articles/CBMihgFBVV95cUxPYXlEaDVOeFQwWHdCSFJfX0cyaDhoYWtHUzVOaGkyQWJXbVI0NW9McnZSbkRqd200aHBfdC15R0phakd4a0N5QUZyUWprajRxQWtWT0R2Q2lVQk8wWVM0bHhxQXV4WVVycktLc1BCRkdha0ZPUUZVZXQxWk9SY0F4LXg3ZEtVUQ?oc=5,gnews
