asset,query,published_at_utc,title,summary,url,source
BP,BP,2026-03-20T07:04:14Z,HSBC upgrades BP stock rating on improved deleveraging outlook - Investing.com,,https://news.google.com/rss/articles/CBMivwFBVV95cUxPMEkyS2VGTWZTQU5rVzB0VFlDeEExdUNjc3R3YnVVV3VsSlNTOHpLVUdBSmVlaFpFSnFkX0xjQ2duUVNVVm9veUhuV0ZabFhhY3IzQkpxMGJ2eVBVYmlySnZwWURLYnVLOE9FbDNKMFdXMThHbjg0TUl5QTFYOTZKNW9oZDdhSWpMUEhkcnlGd0d3RWJkTWNQYzNYQVRqV2NKa3E3S3pDbWdaNWtETXJLZUlBbnRxV3BUR3FwMFdsWQ?oc=5,gnews
Unilever,Unilever,2026-03-20T07:04:00Z,McCormick says it's in talks over a potential Unilever Foods deal - Stock Titan,,https://news.google.com/rss/articles/CBMie0FVX3lxTFBkWnNZdHdhU1dObVhuejMxbGlwZndOSkZpVEM0Y2xxNU9xOFRDek1yZzV4Tjc4SWVsb0JVaUdQemwzaVVjaXBDTmwzdnM5bHpXdlVwX2RaMU5CQnBqTFlqcjBJLXNibkdtc00tNHUwZkVlcXktakMtZDFrWQ?oc=5,gnews
XRP,XRP,2026-03-20T06:53:24Z,SEC-CFTC Joint Ruling Classifies XRP as Digital Commodity: Price Hits $1.45 Amid ETF Deadline - AD HOC NEWS,,https://news.google.com/rss/articles/CBMixgFBVV95cUxNdGRXZ1pDbVEtSmRmbFdXdjRkNkhDLU5FWXpLdGVCU19ZRUw0ZXZURHFldldWMml0V2wzTmJaeUNQeGpKZ09kWUsyVW42NTlMN0c0eWx0c0s1eVgzR0pZMUQwZ2pEZmYtb1RPUHZOZXJ2VEJwQXZpVWw1LWQ5blRMY2ZTYTJRUkR6a1QwZDdxcll6LW1jU0xiZ2RUTjhnVEdROVlONlpiaGZfckV4b2FlMkZZMHgydjZRZVFaRlBRUElJbDB3VlE?oc=5,gnews
XRP,XRP,2026-03-20T06:50:29Z,XRP Soars After SEC Ruling—Can Bulls Hold Ground? - Phemex,,https://news.google.com/rss/articles/CBMiogFBVV95cUxNUWNOMzFqN2hvT0t6Q1lXZDBZdXhKV0diZUlScmFwSWRrQU9GZ2FSSWRvZlZNcFRicEpEN3FoZGpQUDJsVFhKRUhKNGQyb290TVVrWGtVQmIxRnZjWjdvX01aRXJITUtBM29yUHA3UW1Cdk14SHZhNkdyM2tjQVNLN0kxSUlENEd4Q2xyMWVMQVVQenlPVDg4TDVRVFJGdElWa3c?oc=5,gnews
Alphabet,GlobalFeed,2026-03-20T06:48:00Z,Verteidigung: Die Bundeswehr baut ein drittes Cloud-Standbein auf,Nach der umstrittenen Kooperation mit Google setzt die Bundeswehr auf eine Open-Source-Lösung. Die Open Defense Cloud soll auch auf dem Gefechtsfeld eingesetzt werden.,https://www.handelsblatt.com/politik/deutschland/verteidigung-die-bundeswehr-baut-ein-drittes-cloud-standbein-auf-01/100209444.html,rss:handelsblatt.com
NVIDIA,NVIDIA,2026-03-20T06:40:53Z,"Samsung foundry shows signs of stabilization as Nvidia, Tesla orders underscore AI chip capabilities - digitimes",,https://news.google.com/rss/articles/CBMinAFBVV95cUxObl9hNk5LSWg3bU0yZE95dDdNWGl5bk5JZm5lMHFtMUZHRXBFbTVmMnZxdWxOUF8zb3RWOEFZZndleDctZVk0cUVESW5CcnN0MEE5Ymx0QlhEOUV3eFA5c3pOa0NZSmFtaGVPUTYtekhlYms0Z2d3bWR4M1VhWjBxOEdMLVo5TkJueXVCaS1NR2tod1Z0MmdwVV9mWW0?oc=5,gnews
Coinbase,COIN,2026-03-20T06:35:24Z,"Blazpay, USD Coin, and Tether Compared: The Explosive Top - openPR.com",,https://news.google.com/rss/articles/CBMilAFBVV95cUxNMlBoaVNzTG5KdE8wUTRrejZoU0NpV19OWkFCQ1JlZmRSejVVRGpVeUt6R0FLY2V1OXBROHEwTHdZN0RwMl9pR01JdFduZ0hqeTFaYmxPZnBRYUhxaU12YUJQSE1DMjlOREJkT1RYUnhHM1NDNTNmMk52RDhIeTlzZG5fTTV4RjVsRjE5SFlrY1hESUtx?oc=5,gnews
Ethereum,ETH Ethereum,2026-03-20T06:30:32Z,"Ethereum price prediction: Downside risk intensifies as ETH loses ground near $2,100 - Traders Union",,https://news.google.com/rss/articles/CBMipwFBVV95cUxObHdBaG9fWDNuM2hfMll3TGV3V1lGbzNrWDZwdG4tcXdQeFE5c3RwUExQOHZvVlhaR2RLLWVPS0IwWmU4LWpDWXAtUkEtNFp3X0hmT0lfX2JSaHF6T25PQnBPazM3ZHVaM1BpOEZReHczZ1RFd2tBN1dBYmUzNzdLcTdET1RSdExGb3JnbHFKcElZMTJsMC0xcVZmTWRBS1d4MkZUbDN2RQ?oc=5,gnews
XRP,XRP,2026-03-20T06:22:30Z,XRP USD Rebounds From -1.39% Dip as Goldman Sachs Accumulates $154M - Meyka,,https://news.google.com/rss/articles/CBMilwFBVV95cUxQUGZXQ193dVQ3Q0pxcUlhOGlONUNkRDMtMkNzUmRKVnpXU3F3U3ktWHlCWFRQX0dBc0lGOG50VlI3Rkx1b0hqQUVkR0MtQklDc2V6bkhhN3VHTVFwMzVhem9tYjRiWXdmTURhVkhXNDNrajgwMWl3Q1Q2VHN5cnJQeGVDUGVBcjhwRzY3bUhrbVFsNHk5RFZ3?oc=5,gnews
Unilever,GlobalFeed,2026-03-20T06:19:36Z,Konsumgüter: Unilever prüft Fusion des Lebensmittelgeschäfts mit McCormick,Der britisch-niederländische Konsumgüterriese will sich einem Bericht zufolge stärker auf sein Geschäft mit Beautyprodukten konzentrieren. Die Lebensmittelsparte soll neu aufgestellt werden.,https://www.handelsblatt.com/unternehmen/handel-konsumgueter/konsumgueter-unilever-prueft-fusion-des-lebensmittelgeschaefts-mit-mccormick/100210181.html,rss:handelsblatt.com
NVIDIA,NVDA,2026-03-20T06:14:55Z,Nvidia (NVDA) Stock; Drops Slightly as $1 Million GPU Deal with AWS Surfaces - CoinCentral,,https://news.google.com/rss/articles/CBMie0FVX3lxTE4takFnRlBpeFoxQm1lTHBPdWZRb05Edy1KaGhhZHI3b3ZQSXdsRExEUXlHcTdrY3RHWGlnR3hvbDdBTUl4SW1Hek9JUDJsWkx6VHFLZEM0dE9tSXhEMDhheG1TZ1lmOUhzZnVsTFFTNXpDUjhfWHktbFhCOA?oc=5,gnews
Bitcoin,BTC Bitcoin,2026-03-20T06:03:15Z,Bitcoin price prediction: Sideways movement expected? BTC stuck under key resistance - Traders Union,,https://news.google.com/rss/articles/CBMipAFBVV95cUxPY1NfMUVvZXBRaldLQnFsNk53cHlheXd2NExHRjg5TThhMXNvZkowQ25UNGljNklTSnRvU3E2YmstUC00Rlk2blVNVVhxcFdacTI1em1vckVnMU14NFdsWjhmandlRW9qSHA2YjR2cG9xNm50VnoyS0xIMDFGbEN1aFpKb0hMWHUtRTVPWVBWNk16MGZYLUJ1d0lXZkNDamsxRktQaQ?oc=5,gnews
