asset,query,published_at_utc,title,summary,url,source
Solana,Solana,2025-10-17T22:10:22Z,Saros Accelerates Solana DeFi Growth with BTCFi and Stablecoin Expansion - Block Telegraph,,https://news.google.com/rss/articles/CBMicEFVX3lxTFBudy1TdHpnNnJ3Z19TeGRmdUNGbUd4UGhrVzJjZFNLeC0wVlZ5WDNZQ25pWWJmQ0FIdXNweGdsOHBXd3hmVGduaHRoYllDUVEzUkJOU0hhTUtGUmZ2OUFQb2FnZTd4MWxoZm85N3R3Y2I?oc=5,gnews
Coinbase,COIN,2025-10-17T22:09:48Z,MrBeast Files Trademark for Banking and Crypto App - Brave New Coin,,https://news.google.com/rss/articles/CBMijAFBVV95cUxQaHgzcVcxVXg2bFJxSGs4N0Q0NHh6NEhaanRaajJOcG5kdklTb082Z0lqSFRlSlZvU21CcUlpX1lQcHBSZ19UbDJhNTNfTjRVY1BTanZLalFRMm93a0hrNXYyZkNaS3FFVmVrcEY4UDNWZjNta2EySDl5WHQ1bVJTUUptbVRzWDlObTQteQ?oc=5,gnews
Solana,Solana,2025-10-17T22:09:00Z,Solana Price Prediction: Nasdaq-Listed Firm Increases SOL Holdings – Are Institutions Buying the Dip? - Cryptonews,,https://news.google.com/rss/articles/CBMixAFBVV95cUxObG9CSEpnaHFRSlBhSkpsZDJjV0FrQ3pqOV8zQnhPN0JmUWdMcnZnX2wzNXZMODM1NmlBLXhyVE01Q1g1ZHpjb25SanBFMEtqeUUwWFBKR3NZNE0tV3JCc3lJVFQyYWRCQ05VVk52bHVDMmNxNGxHUzJNUGVDTGJOeHVJb01uRk5CNWhmSExKM1dlV295OTR3WXRORDZ0cV9KeUluZXp5LTE4SFNiVGFYMVBlOW56bmU1Q1lqWTIzYW5LcERu?oc=5,gnews
Bitcoin,BTC Bitcoin,2025-10-17T22:00:40Z,BTC News Today: Florida Proposal Sparks Major Shift: Bitcoin and ETFs for State Funds - livebitcoinnews.com,,https://news.google.com/rss/articles/CBMitwFBVV95cUxOS1VPdE1jWFZnbXUtSTN2ZXFaUGNVWkNyVVhvWUp4d2cyVWNGaVh3ZEppYm1OWlJxOGJvV0xGcml6MlNrSmlQSjY3eEt4bFRCNkpNb3Y1X1NEZThkdHg3cjZ2RjFQTFN3bDhsMVhOSHhhTnpZUU15Y2U0aVpaUTQwY3ZLbnlDM1NMaDk2R1JTQk0xaGY1MUJoalUwLUlDa2Qwa0hRMDd3b24wVUstQ2xmUmo0a1lfSVk?oc=5,gnews
Coinbase,COIN,2025-10-17T21:47:07Z,Market Overview: Will COIN stock benefit from green energy trends - July 2025 Rallies & Free Accurate Trade Setup Notifications - Trung tâm Dự báo KTTV quốc gia,,https://news.google.com/rss/articles/CBMigAFBVV95cUxQREQtMnVyMC1OcmhJSXkxS1RsY1JtZjE3YllwRUgyZC12bTllR0ZldURKUGoxQUV2Y3RCclFKS0pWZkZ4QWxGcmdCdVFUeVdkcUhyWTVmV3FrWUhpM0lHWnZhWTFiOHg1bFNiVHNfOGxEMVRybXVBQlU5OEp6RThkMg?oc=5,gnews
